94f02f7a,"Risk for HIV following a diagnosis of syphilis, gonorrhoea or chlamydia: 328,456 women in Florida, 2000–2011"
34716d17,Biomechanical analysis for handle stability during maximum push and pull exertions
754dfbcd,Perceived everyday discrimination and psychological distress: does social support matter?
cb7a5394,"Alcohol-Related Risky Behavior Patterns and Their Association With Alcohol Use and Perceived Alcohol Stigma in Moshi, Tanzania"
f2e34c90,Discontinuation of intravenous oxytocin in the active phase of induced labour
222bd1d9,"Membrane integration and intracellular transport of the coronavirus glycoprotein E1, a class III membrane glycoprotein"
dcdff688,Proximal Esophageal Stenosis in Head and Neck Cancer Patients after Total Laryngectomy and Radiation
