b713123d;risk hiv follow diagnosi syphili gonorrhoea chlamydia women florida
044c42d7;biomechan analysi handl stabil maximum push pull exert
0fca1bb4;perceiv everyday discrimin psycholog distress doe social support matter
5ae6fbaa;alcohol rel riski behavior pattern associ alcohol use perceiv alcohol stigma moshi tanzania
96a1ded6;discontinu intraven oxytocin activ phase induc labour
3e7a3d82;membran integr intracellular transport coronaviru glycoprotein e class iii membran glycoprotein
47bda03c;proxim esophag stenosi head neck cancer patient total laryngectomi radiat
772be4af;object bayesian analysi count experi correl sourc background
7983ae9d;oxid stress ubiquitin proteolyt age rel macular degener
d11c62de;real tim pcr analysi hiv replic post entri event
e6b77021;molecular base methamphetamine induc neurodegener
87d699ed;glucos transport parasit protozoa
86823327;system approach phagocyt product activ neutrophil monocyt
f43f8151;physic emot interperson impact haart explor realiti hiv seroposit individu combin therapi
697d007d;pattern alcohol consumpt sexual behavior young adult nightclub
baedd194;cardiac genet test single cent pilot studi dominican popul
453b2c1d;explain disproportion high rate advers birth outcom african american impact stress racism relat factor pregnanc
e7e88ddf;alter cytoplasmic to nuclear ratio survivin prognost indic breast cancer
43ac6a2d;chang face long term care look past decad
dc9823c8;autom quantit assess her neu immunohistochem express breast cancer
