730835;precari employ mental health systemat review meta analysi longitudin studi
639055;associ parent self efficaci diet physic activ bodi composit cardiorespiratori fit swedish preschool result ministop trial
251657;veget cover relat socioeconom factor tropic citi assess sub met resolut imageri
714704;covid mitig behavior age group unit state april jun
934912;metformin suppress nrf mediat chemoresist hepatocellular carcinoma cell increas glycolysi
650815;therapeut effect safe use plant deriv polyphenol compound cardiovascular diseas review
381473;inositol hexakisphosph kinas promot focal adhes turnov interact dynein intermedi chain
498997;incomplet converg glide mammal skeleton
803199;contemporari multidisciplinari manag sinonas mucos melanoma
433859;effect phytolith rice straw biochar soil buffer capac ph silicon bioavail
473305;charact displac midst background evolut island popul anoli lizard spatiotempor perspect
186579;institut incorpor inequ case minor health inequ europ
191561;fractur nonunion clavicl surgic reduct year old girl case report
274014;nitric oxid phytohormon interact respons lactuca sativa salin stress
581491;predict factor clinicopatholog characterist sentinel lymph node metastasi t t breast cancer
416333;hsa circ suppress prolifer metastasi emt promot apoptosi non smal cell lung cancer mir p foxp pathway
694862;childhood maltreat associ chang mitochondri bioenerget matern neonat immun cell
183225;effect neighbour locat nutrient distribut root forag behaviour common sunflow
964580;mandat social disclosur analysi respons california transpar suppli chain act
891841;compar carbon footprint analysi dispos reusabl vagin specula
929746;capsaicin amelior nephrotox induc methotrex
909284;synergist effect liposom encapsul atorvastatin calcium curcumin target dysfunct endotheli cell reduc atherosclerosi
909732;updat recommend advisori committe immun practic use hepat vaccin postexposur prophylaxi preexposur prophylaxi intern travel
206729;earli humor respons hemodialysi patient inactiv sars cov vaccin
610254;explain high plant rich east asia time diversif tribe lysimachiea primulacea
394255;nitrogen addit reduc rhizospher heterotroph respir subtrop evergreen broad leav forest
896311;evalu effect surveil contain measur patient covid singapor januari februari
633539;make tumour cell type specif dissect ustilago maydis induc tumour develop maiz leav
54792;population bas analysi use radium bone metastat castration resist prostat cancer ontario factor associ treatment complet outcom
879987;color match pollen corolla hide pollen visual crypsi
470985;consensu need broadcast noiseless model exponenti easier presenc nois
819173;ponatinib novel multi tyrosin kinas inhibitor human malign
792654;simpl rule develop stakehold engag plan
871248;domest tether gender differ career path domest respons top research medic school graduat
421807;vitiligo lik lesion patient metastat breast cancer treat cyclin depend kinas cdk inhibitor case report literatur review
794595;thermodynam relativist quantum field confin caviti
392004;social prescrib nation health servic primari care ethic consider
790658;melbourn archaeolog world citi
20450;commun human care effect burnout nurs
477874;real tim qualiti control optic backscatt data biogeochemical argo float
143924;explor live experi long covid black minor ethnic group uk protocol qualit interview art bas method
832758;laminin collagen iv inclus immunoisol microcapsul reduc cytokine medi cell death human pancreat islet
920010;probabilist opinion pool imprecis probabl
816954;commun resourc mass explor wheat grain proteom applic late matur alpha amylas lma problem
832545;log soil nutrient independ explain plant trait express tropic forest
514916;prognost indic outcom hospitalis covid patient neurolog diseas individu patient data meta analysi
