26;"Childhood maltreatment (CM) comprises experiences of abuse and neglect during childhood. CM causes psychological as well as biological alterations in affected individuals. In humans, it is hardly explored whether these CM consequences can be transmitted directly on a biological level to the next generation. 
Here, we investigated the associations between maternal CM and mitochondrial bioenergetics (mitochondrial respiration and intracellular mitochondrial density) in immune cells of mothers and compared them with those of their newborns. In n = 102 healthy mother-newborn dyads, maternal peripheral blood mononuclear cells and neonatal umbilical cord blood mononuclear cells were collected and cryopreserved shortly after parturition to measure mitochondrial respiration and intracellular mitochondrial density with high-resolution respirometry and spectrophotometric analyses, respectively. 
Maternal CM was assessed with the Childhood Trauma Questionnaire Maternal and neonatal mitochondrial bioenergetics were quantitatively comparable and positively correlated. Female newborns showed higher mitochondrial respiration compared to male newborns. Maternal CM load was significantly and positively associated with mitochondrial respiration and density in mothers, but not with mitochondrial respiration in newborns. 
Although maternal and neonatal mitochondrial bioenergetics were positively correlated, maternal CM only had a small effect on mitochondrial density in newborns, which was not significant in this study after adjustment for multiple comparisons. The biological relevance of our finding and its consequences for child development need further investigation in future larger studies. 
This study reports data on mitochondrial bioenergetics of healthy mother-newborn dyads with varying degrees of CM."
31;"Plants regularly encounter patchily distributed soil nutrients. A common foraging response is to proliferate roots within high-quality patches. The influence of the social environment on this behaviour has been given limited attention, despite important fitness consequences of competition for soil resources among plants. 
Using the common sunflower (Helianthus annuus L.), we compared localized root proliferation in a high-quality patch by plants grown alone to that of plants in two different social environments: with a neighbouring plant sharing equal access to the high-quality patch, and with a neighbouring plant present but farther from the high-quality patch such that the focal individual was in closer proximity to the high-quality patch. 
Sunflowers grown alone proliferated more roots within high-nutrient patches than lower-nutrient soil. Plants decreased root proliferation within a high-nutrient patch when it was equidistant to a neighbour. Conversely, plants increased root proliferation when they were in closer proximity to the patch relative to a nearby neighbour. 
Such contingent responses may allow sunflowers to avoid competition in highly contested patches, but to also pre-empt soil resources from neighbours when they have better access to a high-quality patch. We also compared patch occupancy by sunflowers grown alone with two equidistant high-quality patches to occupancy by sunflowers grown with two high-quality patches and a neighbour. 
Plants grown with a neighbour decreased root length within shared patches but did not increase root length within high-quality patches they were in closer proximity to, perhaps because resource pre-emption may be less important for individuals when resources are more abundant. These results show that nutrient foraging responses in plants can be socially contingent, and that plants may account for the possibility of pre-empting limited resources in their foraging decisions."
32;"In this study, we examine investor and firm response to the California Transparency in Supply Chains Act (CTSCA) of 2010. The CTSCA requires large retail and manufacturing firms to disclose efforts to eradicate slavery and human trafficking from their supply chains and is a rare example of mandated corporate social responsibility disclosure. 
Based on a sample of 105 retail companies subject to the CTSCA, we find a significant negative market reaction to the passing of the CTSCA. Furthermore, we find that the reaction is significantly more negative for larger firms and companies facing greater supply chain risks (apparel and footwear retailers), suggesting that investors place a negative value on exposure to legitimacy threats in the social domain. 
With respect to company disclosure response, we document relatively high compliance with the legislation, although we also find that the disclosure response appeared to be more symbolic than substantive in nature. Finally, our analysis indicates that both disclosure choice and disclosure extensiveness were significantly higher for the high-supply chain risk companies, suggesting that the response was influenced by concerns with strategic legitimation. 
Overall, the limited quality of disclosure suggests that, without additional rules and guidance, mandates alone may not lead to meaningful social disclosure."
33;"Healthcare systems in the United States have increasingly turned toward the use of disposable medical equipment in an attempt to save time, lower costs, and reduce the transmission of infections. However, the use of disposable instruments is associated with increased solid waste production and may have negative impacts on the environment, such as increased greenhouse gas emissions. 
The purpose of this study was to inform this discussion; we applied life cycle assessment methods to evaluate the carbon footprints of 3 vaginal specula: a single-use acrylic model and 2 reusable stainless steel models. The functional unit of the study was defined as the completion of 20 gynecologic examinations by either type of speculum. 
The greenhouse gas emissions (eg, carbon dioxide, methane, nitrous oxide) across all life cycle stages, which includes material production and manufacturing, transportation, use and reprocessing, and end-of-life, were analyzed with the use of SimaPro life cycle assessment software and converted into carbon dioxide equivalents. 
The reusable stainless steel grade 304 speculum was found to have a lesser carbon footprint over multiple model scenarios (different reprocessing techniques, autoclave loading/efficiency, and number of uses) than either the reusable stainless steel grade 316 or the disposable acrylic specula. The material production and manufacturing phase contributed most heavily to the total life cycle carbon footprint of the acrylic speculum, whereas the use and reprocessing phase contributed most to the carbon footprints of both stainless steel specula. 
The use of disposable vaginal specula is associated with increased greenhouse gas equivalents compared with reusable alternatives with no significant difference in clinical utility. These findings can be used to inform decision-making by healthcare systems, because they weigh a wide range of considerations in making final purchase decisions; similar analytic methods can and should be applied to other components of health systems' waste streams."
34;"Although methotrexate (MTX) is an effective immunosuppressive and anti-cancer agent, it is associated with side effects, including nephrotoxicity. Capsaicin, a component of hot chilli peppers, induces rapid desensitization of TRPV1 pain receptors and therefore has uses in pain treatment. Capsaicin also has anti-cancer activity, including anti-inflammatory properties. 
Thus, capsaicin may have potential in preventing MTX-induced nephrotoxicity. The purpose of this research work was to observe protective effects of capsaicin towards renal toxicity caused by methotrexate and mechanisms responsible for these effects. As expected, capsaicin had nephroprotective effects in MTX-intoxicated rats. 
Serum creatinine urea, nitric oxide (NO) and renal malondialdehyde (MDA) levels decreased significantly, with a concurrent increase in superoxide dismutase (SOD) and renal glutathione peroxidase (GPx) activities as compared to rats that had been untreated with nephrotoxic. Biochemical analyses confirmed the protective effects of capsaicin. 
We conclude that capsaicin provides protection against MTX-nephrotoxicity in rats via anti-inflammatory and antioxidant activities."
35;"Atherosclerosis is a major cardiovascular disease that causes ischemia of the heart, brain, or extremities, and can lead to infarction. The hypolipidemic agent atorvastatin calcium (Ato) alleviates atherosclerosis by reducing plasma lipid and inflammatory factors. However, the low bioavailability of Ato limits its widespread use and clinical effectiveness. 
Curcumin (Cur), a natural polyphenol with antioxidation and anti-inflammation bioactivities, has potential anti-atherosclerosis activity and may reduce Ato-induced cytotoxicity. Liposomes modified using a targeting ligand (E-selectin-binding peptide) were prepared to co-deliver Ato and Cur to dysfunctional endothelial cells (ECs) overexpressing E-selectin. 
Molecules involved in the inhibition of adhesion (E-selectin and intercellular cell adhesion molecule-1 [ICAM-1]) and inflammation (IL-6 and monocyte chemotactic protein 1 [MCP-1]) in human aortic endothelial cells were evaluated using real-time quantitative PCR, flow cytometry, and immunofluorescence staining. 
The antiatherosclerosis effects of liposomes co-loaded with Ato and Cur in vivo were evaluated using ApoE knockout (ApoE-/-) mice. Targeted liposomes delivered Ato and Cur to dysfunctional ECs, resulting in synergistic suppression of adhesion molecules (E-selectin and ICAM-1) and plasma lipid levels. 
Moreover, this treatment reduced foam cell formation and the secretion of inflammatory factors (IL-6 and MCP-1) by blocking monocyte migration into the intima. In addition, Cur successfully reduced Ato-inducible cytotoxicity. Both in vitro and in vivo experiments demonstrated that cell-targeted co-delivery of Ato and Cur to dysfunctional ECs drastically reduces atherosclerotic lesions with fewer side effects than either Ato or Cur alone."
38;"Postexposure prophylaxis (PEP) with hepatitis A (HepA) vaccine or immune globulin (IG) effectively prevents infection with hepatitis A virus (HAV) when administered within 2 weeks of exposure. Preexposure prophylaxis against HAV infection through the administration of HepA vaccine or IG provides protection for unvaccinated persons traveling to or working in countries that have high or intermediate HAV endemicity. 
The Advisory Committee on Immunization Practices (ACIP) Hepatitis Vaccines Work Group conducted a systematic review of the evidence for administering vaccine for PEP to persons aged >40 years and reviewed the HepA vaccine efficacy and safety in infants and the benefits of protection against HAV before international travel. 
The February 21, 2018, ACIP recommendations update and supersede previous ACIP recommendations for HepA vaccine for PEP and for international travel. Current recommendations include that HepA vaccine should be administered to all persons aged ≥12 months for PEP. In addition to HepA vaccine, IG may be administered to persons aged >40 years depending on the provider's risk assessment. 
ACIP also recommended that HepA vaccine be administered to infants aged 6-11 months traveling outside the United States when protection against HAV is recommended. The travel-related dose for infants aged 6-11 months should not be counted toward the routine 2-dose series. The dosage of IG has been updated where applicable (0.1 mL/kg). 
HepA vaccine for PEP provides advantages over IG, including induction of active immunity, longer duration of protection, ease of administration, and greater acceptability and availability."
44;"What causes the disparity in biodiversity among regions is a fundamental question in biogeography, ecology, and evolutionary biology. Evolutionary and biogeographic processes (speciation, extinction, dispersal) directly determine species richness patterns, and can be studied using integrative phylogenetic approaches. 
However, the strikingly high richness of East Asia relative to other Northern Hemisphere regions remains poorly understood from this perspective. Here, for the first time, we test two general hypotheses (older colonization time, faster diversification rate) to explain this pattern, using the plant tribe Lysimachieae (Primulaceae) as a model system. 
We generated a new time-calibrated phylogeny for Lysimachieae (13 genes, 126 species), to estimate colonization times and diversification rates for each region and to test the relative importance of these two factors for explaining regional richness patterns. We find that neither time nor diversification rates alone explain richness patterns among regions in Lysimachieae. 
Instead, a new index that combines both factors explains global richness patterns in the group and their high East Asian biodiversity. Based on our results from Lysimachieae, we suggest that the high richness of plants in East Asia may be explained by a combination of older colonization times and faster diversification rates in this region."
46;"Increasing global atmospheric nitrogen (N) deposition has a considerable impact on soil respiration. Due to different carbon dioxide (CO2) resources of different components of soil respiration, there may be different mechanisms by which soils respond to N additions. The aims of this study are to investigate the effects of N additions on total soil respiration (RST), rhizospheric respiration (RSR) and heterotrophic respiration (RSH), and to elucidate the potential causal mechanisms. 
An artificial N addition experiment was conducted in an evergreen broad-leaved forest at the western edge of the Sichuan Basin in China. The effects of three N treatment levels (+0, +50, +150 kg N ha−1 yr.−1) were measured, with the N application initiated in April 2013. Trenching method was used for partitioning RST into RST and RSR. 
The values of RST and its components were measured monthly from May 2015 to April 2016. The mean annual RST was 1.92 ± 0.18 μmol CO2 m−2 s−1, with RSH and RSR contributing 75 ± 1% and 25 ± 1% to RST, respectively. Nitrogen addition significantly reduced RST and its two components, as well as the contribution of RSR to RST. 
Microbial biomass carbon (C) and pH in bulk soil decreased significantly after N application. Nitrogen addition had no effect on rhizospheric soil biochemical properties. RSR was significantly positively correlated with root biomass of Castanopsis platyacantha, while RSH was significantly positively correlated with the concentrations of microbial biomass C (MBC) and microbial biomass N (MBN) for bulk soil. 
The positive correlation between RSR and root biomass indicates that N application reduced RSR by reducing belowground C allocation and thus C inputs to the rhizosphere. The value of RSH decreased primarily due to a reduction in microbial activity and soil organic matter decomposition in root-free soil after N was added. 
The presence of plant roots may mitigate the effect of N inputs to the rhizosphere via alteration of root morphology and exudates."
47;"Coronavirus disease 2019 (COVID-19) was first reported in Wuhan, China, in December 2019, and has since spread globally, resulting in >95,000 confirmed COVID-19 cases worldwide by March 5, 2020 (1). Singapore adopted a multipronged surveillance strategy that included applying the case definition at medical consults, tracing contacts of patients with laboratory-confirmed COVID-19, enhancing surveillance among different patient groups (all patients with pneumonia, hospitalized patients in intensive care units [ICUs] with possible infectious diseases, primary care patients with influenza-like illness, and deaths from possible infectious etiologies), and allowing clinician discretion (i.e., option to order a test based on clinical suspicion, even if the case definition was not met) to identify COVID-19 patients. 
Containment measures, including patient isolation and quarantine, active monitoring of contacts, border controls, and community education and precautions, were performed to minimize disease spread. As of March 5, 2020, a total of 117 COVID-19 cases had been identified in Singapore. This report analyzes the first 100 COVID-19 patients in Singapore to determine the effectiveness of the surveillance and containment measures. 
COVID-19 patients were classified by the primary means by which they were detected. Application of the case definition and contact tracing identified 73 patients, 16 were detected by enhanced surveillance, and 11 were identified by laboratory testing based on providers' clinical discretion. Effectiveness of these measures was assessed by calculating the 7-day moving average of the interval from symptom onset to isolation in hospital or quarantine, which indicated significant decreasing trends for both local and imported COVID-19 cases. 
Rapid identification and isolation of cases, quarantine of close contacts, and active monitoring of other contacts have been effective in suppressing expansion of the outbreak and have implications for other countries experiencing outbreaks."
48;"The biotrophic fungus Ustilago maydis causes smut disease on maize (Zea mays), which is characterized by immense plant tumours. To establish disease and reprogram organ primordia to tumours, U. maydis deploys effector proteins in an organ-specific manner. However, the cellular contribution to leaf tumours remains unknown. 
We investigated leaf tumour formation at the tissue- and cell type-specific levels. Cytology and metabolite analysis were deployed to understand the cellular basis for tumourigenesis. Laser-capture microdissection was performed to gain a cell type-specific transcriptome of U. maydis during tumour formation. 
In vivo visualization of plant DNA synthesis identified bundle sheath cells as the origin of hyperplasic tumour cells, while mesophyll cells become hypertrophic tumour cells. Cell type-specific transcriptome profiling of U. maydis revealed tailored expression of fungal effector genes. Moreover, U. maydis See1 was identified as the first cell type-specific fungal effector, being required for induction of cell cycle reactivation in bundle sheath cells. 
Identification of distinct cellular mechanisms in two different leaf cell types and of See1 as an effector for induction of proliferation of bundle sheath cells are major steps in understanding U. maydis-induced tumour formation. Moreover, the cell type-specific U. maydis transcriptome data are a valuable resource to the scientific community."
49;"Radium-223 (Ra223) prolongs the survival and improves the quality of life of men with metastatic, castration-resistant prostate cancer (mCRPC) to bones. However, compared to other mCRPC therapies, using Ra223 comes with its unique challenges. Hence, we aimed to identify Ra223 utilization patterns under real-world conditions, as well as factors predicting treatment completion and outcome. 
In this retrospective chart analysis, 198 mCRPC patients were identified that had received Ra223 outside of clinical trials or access programs from January 2015 to October 2016 at four cancer centres in Ontario. The main outcomes studied were Ra223 completion rate, reasons for early treatment discontinuation, overall survival, and survival differences in patients completing Ra223 therapy versus patients receiving <6 cycles of Ra223. 
In addition, patient and disease characteristics were analysed to identify predictors of treatment completion and survival. In this cohort of patients mostly pretreated with abiraterone and/or enzalutamide (92.4%), almost half of which had also received docetaxel (48.5%), the Ra223 completion rate was 46.5%, and the actuarial median survival was 13.3 months. 
The main reason for early Ra223 discontinuation was disease progression, and Ra223 non-completion was associated with poorer outcome (median survival 8.1 months [6.0-12.2] versus 18.7 months [15.3-22.3] in men completing Ra223, p<0.0001). Lymph node metastases and a high baseline prostate-specific antigen (PSA) were independent predictors of early treatment discontinuation. 
Multivariable Cox proportional hazards models revealed early Ra223 discontinuation, baseline anemia, high PSA, prior skeletal-related events, visceral metastases, and being referred to another centre for Ra223 therapy as predictors of worse outcome. Despite a lower completion rate than observed under clinical trial conditions, the real-world results achieved with Ra223 are encouraging. 
If prospectively validated, predictive patient and disease characteristics identified in our cohort might become instrumental to identify mCRPC patients likely to complete and to most benefit from Ra223 therapy."
53;"Visual signals attractive to friends may also attract enemies.  The bright colors of anthers and pollen have generally been thought to attract pollinators. We hypothesize that visual crypsis of anthers, and particularly pollen, should be favored in flowering plants because protection from pollen collectors reduces the loss of male gametes. 
To understand adaptive strategies relating to the color of pollen, we measured the color of pollen, undehisced anther sacs, and their background, the corolla, with a spectrometer for 104 insect-pollinated flowering species from a natural community in Hengduan Mountains, southwest China. The colors of anthers, pollen and corollas were diverse in these species. 
The color diversity of exposed pollen was significantly higher than that of concealed pollen (i.e. where anthers are enclosed or shielded by corollas). The color contrast between pollen and corolla was significantly smaller in species with exposed pollen than in those with concealed pollen. Unlike anther color, exposed pollen color tended to match its background corolla color. 
Our phylogenetic comparative analysis showed contrasting effects of pollen color patterns between flowers with exposed pollen and those with concealed pollen, revealing a strategy of hiding pollen from pollen thieves via visual crypsis."
59;"Human malignancies are often the result of overexpressed and constitutively active receptor and non-receptor tyrosine kinases, which ultimately lead to the mediation of key tumor-driven pathways. Several tyrosine kinases (ie, EGFR, FGFR, PDGFR, VEGFR), are aberrantly activated in most common tumors, including leukemia, glioblastoma, gastrointestinal stromal tumors, non-small-cell lung cancer, and head and neck cancers. 
Iclusig™ (ponatinib, previously known as AP24534) is an orally active multi-tyrosine kinase inhibitor and is currently approved by the US Food and Drug Administration for patients with chronic myeloid leukemia and Philadelphia chromosome-positive acute lymphoblastic leukemia, specifically targeting the BCR-ABL gene mutation, T315I. 
Due to ponatinib's unique multi-targeted characteristics, further studies have demonstrated its ability to target other important tyrosine kinases (FGFR, PDGFR, SRC, RET, KIT, and FLT1) in other human malignancies. This review focuses on the available data of ponatinib and its molecular targets for treatment in various cancers, with a discussion on the broader potential of this agent in other cancer indications."
62;"To make research responsible and research outcomes meaningful, it is necessary to communicate our research and to involve as many relevant stakeholders as possible, especially in application-oriented-including information and communications technology (ICT)-research. Nowadays, stakeholder engagement is of fundamental importance to project success and achieving the expected impact and is often mandatory in a third-party funding context. 
Ultimately, research and development can only be successful if people react positively to the results and benefits generated by a project. For the wider acceptance of research outcomes, it is therefore essential that the public is made aware of and has an opportunity to discuss the results of research undertaken through two-way communication (interpersonal communication) with researchers. 
Responsible Research and Innovation (RRI), an approach that anticipates and assesses potential implications and societal expectations regarding research and innovation, aims to foster inclusive and sustainable research and innovation. Research and innovation processes need to become more responsive and adaptive to these grand challenges. 
This implies, among other things, the introduction of broader foresight and impact assessments for new technologies beyond their anticipated market benefits and risks. Therefore, this article provides a structured workflow that explains ""how to develop a stakeholder engagement plan"" step by step."
