69;"Gendered differences in career paths of medical graduates persist globally. We aim to explore the impact of domestic tethers on the career paths of physicians by studying gendered differences in domestic burdens of physicians as well as differences in perceptions around the impact of domestic work on professional advancement. 
A web-based survey including 38 questions was sent to all 3866 physician alumni of the top academic medical school in Lebanon. Data was collected between November 2018 and January 2019, with up to three invite reminders. Overall, 382 were included in the final analysis, 124 women (32%), 258 men (68%). 
The study had a response rate of 10.4%. Findings show that a greater percentage of men were married and had children (77.5% vs 62.1%, p = 0.004, 77.9% vs 51.6%, <0.001, respectively). Majority of both women and men held full-time positions (82.1% and 87.1%), having children however reduced the odds significantly [OR = 0.2, 95% CI: (0.1–0.6), p = 0.01]for women, while only older age reduced it for men (OR = 0.1,95% CI: (0.04–0.2), p<0.001]. 
Among full-time physicians, men and women spent similar time on professional activities (60.2hrs/wk vs 58.3hrs/wk, p = 0.32). Women spent more time on parenting and household work (23.5hrs/wk vs 10.4hrs/wk, <0.001; 8.9hrs/wk vs 6.0hrs/wk, p = 0.001, respectively). Women physicians’ spouses contributed to 14.5 hours/week of total time on domestic activities whereas men physicians’ spouses spent two folds more time on domestic activities (35.0 hours/week, P<0.001). 
Of physicians with children, a higher percentage of women than men reported that children prevented their career advancement or their participation in development opportunities (43.8% vs 15.9%, p<0.001; 50.0% vs 19.4%, p<0.001, respectively). A greater percentage of women than men scaled back their career after first child (31.3% vs 3.5%, <0.001). 
Of married/partnered physicians, fewer women than men reported their career took priority over their partner’s when conflicts arose, (52.0% vs 86.0%, p<0.001). These findings highlight the heavier impact of domestic tethers on the career paths of women physicians than men physicians. Men are more likely than women to hold full-time positions in the early advancement defining phases of their careers. 
Full-time women shoulder more domestic work than men and experience more professional advancement concessions. Closing persistent gender gaps in medicine requires addressing inequities in domestic burdens through strategies that include mentorship on domestic tethers, support of on-site child-care and advocacy for parental leave policies that encourage shared care-work."
72;"Cyclin-dependent kinase (CDK) 4/6 inhibitors have revolutionized the treatment landscape of hormone receptor-positive (HR+), human epidermal growth factor receptor 2-negative (HER2-) metastatic breast cancer, with an impressive efficacy and safety profile. Cytopenia is the main adverse event, which is both predictable and manageable. 
Here, we report a case of CDK4/6 inhibitor-induced vitiligo-like lesions. Vitiligo or vitiligo-like lesions are a rare adverse event; only a few cases are reported in the literature. A 71-year-old female patient was diagnosed initially with early-stage right breast cancer (HR+/HER2-) and was treated with breast-conserving surgery followed by chemotherapy, radiotherapy, and hormonal therapy. 
A few years later, she developed metastatic disease to the hilar lymph nodes, and to multiple skeletal sites, including the left scapula, left shoulder, left iliac bone, and dorsal vertebrae, for which she was treated with ribociclib and letrozole. While on treatment, she developed hypopigmented lesions involving both hands, feet, and face, which were described as vitiligo-like lesions. 
CDK4/6 inhibitor-induced vitiligo is a rare and unpredictable adverse event. This case report highlights the rarity of this adverse event, the dilemma related to the optimal treatment, and decisions related to continuation, holding, or switching CDK4/6 inhibitors."
78;"We investigate the quantum thermodynamical properties of localised relativistic quantum fields, and how they can be used as quantum thermal machines. We study the efficiency and power of energy transfer between the classical gravitational degrees of freedom, such as the energy input due to the motion of boundaries or an impinging gravitational wave, and the excitations of a confined quantum field. 
We find that the efficiency of energy transfer depends dramatically on the input initial state of the system. Furthermore, we investigate the ability of the system to extract energy from a gravitational wave and store it in a battery. This process is inefficient in optical cavities but is significantly enhanced when employing trapped Bose Einstein condensates. 
We also employ standard fluctuation results to obtain the work probability distribution, which allows us to understand how the efficiency is related to the dissipation of work. Finally, we apply our techniques to a setup where an impinging gravitational wave excites the phononic modes of a Bose Einstein condensate. 
We find that, in this case, the percentage of energy transferred to the phonons approaches unity after a suitable amount of time. These results give a quantitative insight into the thermodynamic behaviour of relativistic quantum fields confined in cavities."
79;"Policy Points Social prescribing is proposed as a way of improving patients' health and well-being by attending to their non-clinical needs. This is done by connecting patients with community assets (typically voluntary or charitable organizations) that provide social and personal support. In the United Kingdom, social prescribing is used to improve patient well-being and reduce use of National Health Service resources. 
Although social prescribing schemes hold promise, evidence of their effects and effectiveness is sparse. As more information on social prescribing is gathered, it will be important to consider the associated ethical issues for patients, clinicians, link workers, and community assets."
81;"Reviewing the results of several decades of excavation in the center of Melbourne, Australia, provides the opportunity to reflect on what archaeological evidence has to contribute to understandings of the colonial city. The city has been shaped by its role as a colonial entrepot, a gold rush port, and a nineteenth-century metropolitan center. 
Its rich archaeological record derives from the intersection of heritage controls and a development boom. Data from archaeological excavations drives new perspectives on Melbourne itself, revealing a city intimately connected with the gold rush boom that fuelled its growth. Archaeological data also shed light on the specific and distinctive historical circumstances that influenced the development of cities established in the nineteenth century, including transnational migration and trade along with emerging concerns over public health and sanitation."
83;"Healthcare professionals may have certain psychological characteristics which contribute to increasing the quality of their professional performance. Study the effect that humanization of care and communication have on the burnout syndrome in nursing personal. The sample included a total of 330 Spanish nurses. 
Analytical instruments used were the Health Professional's Humanization Scale (HUMAS), Communication Styles Inventory Revised (CSI-R) and Brief Burnout Questionnaire Revised (CBB-R). Two broad nursing profiles could be differentiated by their level of humanization (those with scores over the mean and those with scores below it in optimistic disposition, openness to sociability, emotional understanding, self-efficacy, and affection), where the largest group had the high scores. 
A communication repertoire based on verbal aggressiveness impacted indirectly on the effect of humanization on burnout, mainly in the personal impact component. We observed the relation of humanization profiles in nursing staff with the job dissatisfaction and burnout components. Besides that, some communication styles, verbal aggressiveness and questioningness, have an indirect effect on the relationship between humanization profiles and job dissatisfaction. 
The results on the relationship between communication styles and burnout, and the mediator effect of communication styles on the relationship between humanization of care and burnout in nursing personnel are discussed."
92;"Some people experience prolonged symptoms following an acute COVID-19 infection including fatigue, chest pain and breathlessness, headache and cognitive impairment. When symptoms persist for over 12 weeks following the initial infection, and are not explained by an alternative diagnosis, the term post-COVID-19 syndrome is used, or the patient-defined term of Long Covid. 
Understanding the lived experiences of Long Covid is crucial to supporting its management. However, research on patient experiences of Long Covid is currently not ethnically diverse enough. The study aim is to explore the lived experience of Long Covid, using qualitative interviews and art-based methods, among people from ethnically diverse backgrounds (in the UK), to better understand wider systems of support and healthcare support needs. 
Co-created artwork will be used to build on the interview findings. A purposive sampling strategy will be used to gain diverse experiences of Long Covid, sampling by demographics, geographic locations and experiences of Long Covid. Individuals (aged >18 years) from Black and ethnic minority backgrounds, who self-report Long Covid symptoms, will be invited to take part in a semi-structured interview. 
Interviews will be analysed thematically. A sub-sample of participants will be invited to co-create visual artwork to further explore shared narratives of Long Covid, enhance storytelling and increase understanding about the condition. A patient advisory group, representing diversity in ethnicity and experiences of Long Covid, will inform all research stages. 
Stakeholder workshops with healthcare professionals and persons, systems or networks important to people's management of Long Covid, will advise on the integration of findings to inform management of Long Covid. The study will use patient narratives from people from diverse ethnic backgrounds, to raise awareness of Long Covid and help inform management of Long Covid and how wider social systems and networks may inform better healthcare service access and experiences."
93;"Extracellular matrix (ECM) molecules have several functions in pancreatic islets, including provision of mechanical support and prevention of cytotoxicity during inflammation. During islet isolation, ECM connections are damaged, and are not restored after encapsulation and transplantation. Inclusion of specific combinations of collagen type IV and laminins in immunoisolating capsules can enhance survival of pancreatic islets. 
Here we investigated whether ECM can also enhance survival and lower susceptibility of human islets to cytokine-mediated cytotoxicity. To this end, human islets were encapsulated in alginate with collagen IV and either RGD, LRE or PDSGR, i.e. laminin sequences. Islets in capsules without ECM served as control. 
The encapsulated islets were exposed to IL-1β, IFN-γ and TNF-α for 24 and 72 h. All combinations of ECM improved the islet cell survival, and reduced necrosis and apoptosis after cytokine exposure (P < 0.01). Collagen IV-RGD and collagen IV-LRE reduced danger-associated molecular patterns (DAMPs) release from islets (P < 0.05). 
Moreover, collagen IV-RGD and collagen IV-PDSGR, but not collagen IV-LRE, reduced NO release from encapsulated human islets (P < 0.05). This reduction correlated with a higher oxygen consumption rate (OCR) of islets in capsules containing collagen IV-RGD and collagen IV-PDSGR. Islets in capsules with collagen IV-LRE showed more dysfunction, and OCR was not different from islets in control capsules without ECM. 
Our study demonstrates that incorporation of specific ECM molecules such as collagen type IV with the laminin sequences RGD and PDSGR in immunoisolated islets can protect against cytokine toxicity."
95;"The question of how the probabilistic opinions of different individuals should be aggregated to form a group opinion is controversial. But one assumption seems to be pretty much common ground: for a group of Bayesians, the representation of group opinion should itself be a unique probability distribution (Madansky [44]; Lehrer and Wagner [34]; McConway Journal of the American Statistical Association, 76(374), 410–414, [45]; Bordley Management Science, 28(10), 1137–1148, [5]; Genest et al. 
The Annals of Statistics, 487–501, [21]; Genest and Zidek Statistical Science, 114–135, [23]; Mongin Journal of Economic Theory, 66(2), 313–351, [46]; Clemen and Winkler Risk Analysis, 19(2), 187–203, [7]; Dietrich and List [14]; Herzberg Theory and Decision, 1–19, [28]). We argue that this assumption is not always in order. 
We show how to extend the canonical mathematical framework for pooling to cover pooling with imprecise probabilities (IP) by employing set-valued pooling functions and generalizing common pooling axioms accordingly. As a proof of concept, we then show that one IP construction satisfies a number of central pooling axioms that are not jointly satisfied by any of the standard pooling recipes on pain of triviality. 
Following Levi (Synthese, 62(1), 3–11, [39]), we also argue that IP models admit of a much better philosophical motivation as a model of rational consensus."
97;"Late-maturity alpha-amylase (LMA) is a wheat genetic defect causing the synthesis of high isoelectric point alpha-amylase following a temperature shock during mid-grain development or prolonged cold throughout grain development, both leading to starch degradation. While the physiology is well understood, the biochemical mechanisms involved in grain LMA response remain unclear. 
We have applied high-throughput proteomics to 4,061 wheat flours displaying a range of LMA activities. Using an array of statistical analyses to select LMA-responsive biomarkers, we have mined them using a suite of tools applicable to wheat proteins. We observed that LMA-affected grains activated their primary metabolisms such as glycolysis and gluconeogenesis; TCA cycle, along with DNA- and RNA- binding mechanisms; and protein translation. 
This logically transitioned to protein folding activities driven by chaperones and protein disulfide isomerase, as well as protein assembly via dimerisation and complexing. The secondary metabolism was also mobilized with the upregulation of phytohormones and chemical and defence responses. LMA further invoked cellular structures, including ribosomes, microtubules, and chromatin. 
Finally, and unsurprisingly, LMA expression greatly impacted grain storage proteins, as well as starch and other carbohydrates, with the upregulation of alpha-gliadins and starch metabolism, whereas LMW glutenin, stachyose, sucrose, UDP-galactose, and UDP-glucose were downregulated. To our knowledge, this is not only the first proteomics study tackling the wheat LMA issue but also the largest plant-based proteomics study published to date. 
Logistics, technicalities, requirements, and bottlenecks of such an ambitious large-scale high-throughput proteomics experiment along with the challenges associated with big data analyses are discussed."
102;"Plant functional traits regulate ecosystem functions but little is known about how co-occurring gradients of land use and edaphic conditions influence their expression. We test how gradients of logging disturbance and soil properties relate to community-weighted mean traits in logged and old-growth tropical forests in Borneo. 
We studied 32 physical, chemical and physiological traits from 284 tree species in eight 1 ha plots and measured long-term soil nutrient supplies and plant-available nutrients. Logged plots had greater values for traits that drive carbon capture and growth, whilst old-growth forests had greater values for structural and persistence traits. 
Although disturbance was the primary driver of trait expression, soil nutrients explained a statistically independent axis of variation linked to leaf size and nutrient concentration. Soil characteristics influenced trait expression via nutrient availability, nutrient pools, and pH. Our finding, that traits have dissimilar responses to land use and soil resource availability, provides robust evidence for the need to consider the abiotic context of logging when predicting plant functional diversity across human-modified tropical forests. 
The detection of two independent axes was facilitated by the measurement of many more functional traits than have been examined in previous studies."
103;"Neurological COVID-19 disease has been reported widely, but published studies often lack information on neurological outcomes and prognostic risk factors. We aimed to describe the spectrum of neurological disease in hospitalised COVID-19 patients; characterise clinical outcomes; and investigate factors associated with a poor outcome. 
We conducted an individual patient data (IPD) meta-analysis of hospitalised patients with neurological COVID-19 disease, using standard case definitions. We invited authors of studies from the first pandemic wave, plus clinicians in the Global COVID-Neuro Network with unpublished data, to contribute. 
We analysed features associated with poor outcome (moderate to severe disability or death, 3 to 6 on the modified Rankin Scale) using multivariable models. We included 83 studies (31 unpublished) providing IPD for 1979 patients with COVID-19 and acute new-onset neurological disease. Encephalopathy (978 [49%] patients) and cerebrovascular events (506 [26%]) were the most common diagnoses. 
Respiratory and systemic symptoms preceded neurological features in 93% of patients; one third developed neurological disease after hospital admission. A poor outcome was more common in patients with cerebrovascular events (76% [95% CI 67–82]), than encephalopathy (54% [42–65]). Intensive care use was high (38% [35–41]) overall, and also greater in the cerebrovascular patients. 
In the cerebrovascular, but not encephalopathic patients, risk factors for poor outcome included breathlessness on admission and elevated D-dimer. Overall, 30-day mortality was 30% [27–32]. The hazard of death was comparatively lower for patients in the WHO European region. Neurological COVID-19 disease poses a considerable burden in terms of disease outcomes and use of hospital resources from prolonged intensive care and inpatient admission; preliminary data suggest these may differ according to WHO regions and country income levels. 
The different risk factors for encephalopathy and stroke suggest different disease mechanisms which may be amenable to intervention, especially in those who develop neurological symptoms after hospital admission."
105;"This paper analyzes an emergent stream of research shedding light on the institutional factors shaping entrepreneurial activity and its effect on economic growth. This integrative analysis spanning a broad spectrum of diverse literature enables a distinction between two different research lines in the field of entrepreneurship. 
The findings of this study, based on articles from the journals included in the Web of Science database, facilitate a broader comprehension of two separate lines of research, which allows an analysis of the interaction among institutions, entrepreneurship, and economic growth. The systematic literature analysis over the last 25 years (1992–2016) of research reveals that institutions could be related to economic growth through entrepreneurship, which would open new research questions about what institutional factors are conducive to entrepreneurship, which in turn spurs economic growth. 
Thus, not only is understanding both complex relationships and their possible sequence useful for planning strategies and public policies, but it is also helpful for advancing and providing new insights in these research fields, which could be complementary and interdisciplinary."
