12;ecolog biomechan play central role gener phenotyp divers unrel taxa invad similar ecolog nich biomechan demand drive converg morpholog transform thu examin converg help elucid key catalyst phenotyp chang glide mammal present classic case converg evolut independ evolv numer clade possess patagia wing membran gener lift glide use phylogenet compar method test skelet morpholog clade extant glide mammal demonstr converg result indic glider skeleton converg glider group consist evolv proport longer gracil limb arborealist like increas patagi surfac area nonetheless interpret glider repres incomplet converg evolutionari model fit analys indic strong select pressur glider trait optima marsupi glider group diverg converg glide group remain separ morphospac rather converg singl morphotyp reflect unexpectedli high level morpholog dispar glider skeleton morpholog divers demonstr fossil glider mesozo era possess uniqu skelet characterist absent extant glider glider morpholog strongli influenc factor bodi size attach locat patagia forelimb vari clade thu converg glider appear driven simpl lengthen limb addit skelet trait reflect nuanc glide apparatu distinct differ evolutionari lineag unexpect result add grow evid incomplet converg preval vertebr clade classic case converg highlight import examin form funct relationship light phylogeni biomechan fossil record
13;sinonas mucos melanoma snmm rare tumor compris sinonas malign snmm frequent occur nasal caviti maxillari sinu typic black patch overal snmm harbor poor prognosi year surviv nasal caviti tumor confer better prognosi sinu melanoma primari manag snmm surgeri feasibl follow adjuv radiotherapi recent studi suggest immunotherapi confer surviv benefit patient advanc diseas multidisciplinari team approach shown optim treatment reduc cost minim advers event maxim chanc cure
15;suppli phytolith rich biochar agrosystem increas soil ph cec nutrient avail ad impact si uptak plant growth studi specif impact influenc soil properti assess role phytolith provid plant avail si use young cambisol highli weather poorli buffer desil nitisol biochar produc rice plant respect enrich si deplet si si ident ph nutrient content larg differ si content g si kg si vs g si kg si compar effect wollastonit casio biomass mineralomass wheat plant soil solut plant devic content soil bioavail si biogen si assess origin cacl kinet extract demast na co alkalin dissolut respect demast techniqu dissolv si phytolith wollastonit soil buffer capac cmolc kg cambisol nitisol ident suppli phytolith biochar increas ph cambisol ni increas content bioavail si from mg kg cambisol mg kg nitisol plant si uptak biomass si mineralomass increas largest nitisol demast techniqu did specif quantifi phytolith pool pool main sourc plant avail si cambisol nitisol amend phytolith biochar ident phytolith si suppli howev soil ph soil buffer capac control transfer si soil plant system largest poorli buffer nitisol effect phytolith biochar si bioavail depend soil constitu properti soil type
16;neg interact speci gener diverg select caus charact displac howev process caus similar diverg use spatial tempor replic island popul anoli lizard assess import neg interact drive trait shift previou work show establish anoli sagrei island drove resid anoli carolinensi perch higher evolv larger toepad test interact s causal predict resurvey subset island year later anoli sagrei establish island survey a carolinensi island perch higher larger toepad howev toepad morpholog chang island distinct shift island anoli commun composit chang thu presenc a sagrei partli explain a carolinensi trait variat space time a carolinensi island previous establish a sagrei perch higher decad ago current a carolinensi perch height correl a sagrei densiti result suggest charact displac like interact evolutionari process system tempor data key detect interact
18;scholar interest relationship social context health recent turn attent upstream understand polit social econom institut shape distribut life chanc context compar minor health inequ european countri n investig arrangements welfar state effort immigr incorpor policies influ distribut health health inequ examin measur health seven wave european social survey result seri multilevel mixed effect model minor health inequ vari context persist account socioeconom differ cross level interact result welfar state effort associ better health group unrel level inequ group contrast polici aim protect minor discrimin correl smaller rel health inequ
20;congenit nonunion clavicl well known patholog children posttraumat nonunion rare entiti nonunion open reduct intern fixat clavicl fractur except pediatr popul report patient present posttraumat pseudarthrosi clavicl surgic treatment pseudarthrosi resect defect bridg iliac crest autograft supplement bone morphogenet protein fix elast stabl intramedullari nail procedur offer stabil achiev fractur consolid safe altern plate clavicl nonunion
21;nitric oxid increas lettuc s toler salin restor hormon balanc consequ reduc na accumul activ defens mechan allow attenu ionic oxid osmot stress agricultur crop continu threaten soil salin plant s abil toler soil salin increas treatment signal molecul nitric oxid no involv plant metabol interact phytohormon fulli describ knowledg role radic signal pathway remain fragment work lactuca sativa lettuc plant subject treatment control nutrient solut snp nutrient solut contain μm sodium nitroprussid snp donor nacl nutrient solut contain mm nacl snp nacl nutrient solut contain snp nacl plant expos condit h then root leav collect use evalu biochem paramet reactiv oxygen speci ro product cell membran damag cell death antioxid enzym activ prolin concentr physiolog paramet pigment concentr gas exchang measur phytohormon content evalu growth toler index nutrient concentr plant expos treatment day l sativa exposur nacl trigger ionic osmot oxid stress result hormon imbal cell death decreas growth deleteri chang correl na content veget tissu ad decreas na accumul stabil miner nutrient concentr maintain photosynthet rate re establish growth no sign action re establish phytohormon balanc result antioxid activ osmot regul consequ increas plant toler salt
23;axillari lymph node statu import prognost factor breast cancer studi explor predict factor sentinel lymph node sln metastasi preoper clinicopatholog featur includ impair glucos toler igt studi compris patient diagnos breast cancer underw surgeri nagasaki harbor medic center april decemb factor assess use univari multivari analys clinicopatholog data cancer includ patient age gender menstrual statu breast ovarian cancer famili histori bodi mass index glycosyl hemoglobin clinic tumor size nipple tumor distanc ntd tumor histolog histolog grade node statu estrogen receptor progesteron receptor human epiderm growth factor receptor type statu ki label index cohort case ratio sln metastasi univari analysi tumor size ntd igt clinic tumor stage associ sln metastasi multivari analysi tumor size ntd igt associ sln metastasi receiv oper characterist curv show sensit specif respect cut off cm tumor size area curv auc confid interv sensit specif respect cut off cm ntd auc confid interv predict risk sln metastasi t t breast cancer patient larger tumor size tumor locat closer nippl igt higher risk sln metastas other
24;non smal cell lung cancer nsclc largest type lung cancer lc higher mortal rate circular rna circrna shown play import role cancer progress therefor studi explor function hsa circ nsclc express level hsa circ microrna p mir p forkhead box p foxp determin quantit real tim polymeras chain reaction qrt pcr ribonucleas r rnase r actinomycin d actd use verifi authent stabil hsa circ cell count kit cck flow cytometri transwel assay use evalu abil prolifer apoptosi migrat invas nsclc cell also western blot wb analysi perform assess level apoptosi epithelial mesenchym transit emt proliferation rel protein foxp protein rna immunoprecipit rip dual luciferas report assay use verifi interact mir p hsa circ foxp besid mice xenograft model construct confirm effect hsa circ nsclc tumor growth vivo hsa circ lowli express nsclc tissu cell overexpress inhibit prolifer migrat invas emt process improv apoptosi nsclc cell mir p spong hsa circ overexpress invert suppress effect overexpressed hsa circ nsclc progress moreov foxp target mir p silenc revers inhibit effect overexpressed hsa circ nsclc progress addit hsa circ overexpress reduc tumor growth nsclc vivo hsa circ spong mir p improv foxp express inhibit nsclc progress studi show hsa circ potenti biomark earli diagnosi nsclc
25;childhood maltreat cm compris experi abus neglect childhood cm caus psycholog biolog alter affect individu human hardli explor cm consequ transmit directli biolog level gener here investig associ matern cm mitochondri bioenerget mitochondri respir intracellular mitochondri densiti immun cell mother compar newborn n healthi mother newborn dyad matern peripher blood mononuclear cell neonat umbil cord blood mononuclear cell collect cryopreserv shortli parturit measur mitochondri respir intracellular mitochondri densiti high resolut respirometri spectrophotometr analys respect matern cm assess childhood trauma questionnair matern neonat mitochondri bioenerget quantit compar posit correl femal newborn show higher mitochondri respir compar male newborn matern cm load significantli posit associ mitochondri respir densiti mother mitochondri respir newborn matern neonat mitochondri bioenerget posit correl matern cm small effect mitochondri densiti newborn signific studi adjust multipl comparison biolog relev find consequ child develop need investig futur larger studi studi report data mitochondri bioenerget healthi mother newborn dyad vari degre cm
30;plant regularli encount patchili distribut soil nutrient common forag respons prolifer root high qual patch influenc social environ behaviour given limit attent despit import fit consequ competit soil resourc plant use common sunflow helianthu annuu l compar local root prolifer high qual patch plant grown plant differ social environ neighbour plant share equal access high qual patch neighbour plant present farther high qual patch focal individu closer proxim high qual patch sunflow grown prolifer root high nutri patch lower nutri soil plant decreas root prolifer high nutri patch equidist neighbour convers plant increas root prolifer closer proxim patch rel nearbi neighbour conting respons allow sunflow avoid competit highli contest patch pre empt soil resourc neighbour better access high qual patch compar patch occup sunflow grown equidist high qual patch occup sunflow grown high qual patch neighbour plant grown neighbour decreas root length share patch did increas root length high qual patch closer proxim to resourc pre empt import individu resourc abund result nutrient forag respons plant social conting plant account possibl pre empt limit resourc forag decis
31;studi examin investor firm respons california transpar suppli chain act ctsca ctsca requir larg retail manufactur firm disclos effort erad slaveri human traffick suppli chain rare exampl mandat corpor social respons disclosur base sampl retail compani subject ctsca signific neg market reaction pass ctsca furthermor reaction significantli neg larger firm compani face greater suppli chain risk apparel footwear retail suggest investor place neg valu exposur legitimaci threat social domain respect compani disclosur respons document rel high complianc legisl disclosur respons appear symbol substant natur final analysi indic disclosur choic disclosur extens significantli higher high suppli chain risk compani suggest respons influenc concern strateg legitim overal limit qualiti disclosur suggest that addit rule guidanc mandat lead meaning social disclosur
32;healthcar system unit state increasingli turn use dispos medic equip attempt save time lower cost reduc transmiss infect howev use dispos instrument associ increas solid wast product neg impact environ increas greenhous ga emiss purpos studi inform discuss appli life cycl assess method evalu carbon footprint vagin specula single us acryl model reusabl stainless steel model function unit studi defin complet gynecolog examin type speculum greenhous ga emiss eg carbon dioxid methan nitrou oxid life cycl stage includ materi product manufactur transport use reprocess end of lif analyz use simapro life cycl assess softwar convert carbon dioxid equival reusabl stainless steel grade speculum lesser carbon footprint multipl model scenario differ reprocess techniqu autoclav loading effici number use reusabl stainless steel grade dispos acryl specula materi product manufactur phase contribut heavili total life cycl carbon footprint acryl speculum use reprocess phase contribut carbon footprint stainless steel specula use dispos vagin specula associ increas greenhous ga equival compar reusabl altern signific differ clinic util find use inform decision mak healthcar system weigh wide rang consider make final purchas decis similar analyt method appli compon health system wast stream
33;methotrex mtx effect immunosuppress anti canc agent associ effect includ nephrotox capsaicin compon hot chilli pepper induc rapid desensit trpv pain receptor use pain treatment capsaicin anti canc activ includ anti inflammatori properti thu capsaicin potenti prevent mtx induc nephrotox purpos research work observ protect effect capsaicin renal toxic caus methotrex mechan respons effect expect capsaicin nephroprotect effect mtx intox rat serum creatinin urea nitric oxid no renal malondialdehyd mda level decreas significantli concurr increas superoxid dismutas sod renal glutathion peroxidas gpx activ compar rat untreat nephrotox biochem analys confirm protect effect capsaicin conclud capsaicin provid protect mtx nephrotox rat anti inflammatori antioxid activ
34;atherosclerosi major cardiovascular diseas caus ischemia heart brain extrem lead infarct hypolipidem agent atorvastatin calcium ato allevi atherosclerosi reduc plasma lipid inflammatori factor howev low bioavail ato limit widespread use clinic effect curcumin cur natur polyphenol antioxid anti inflamm bioactiv potenti anti atherosclerosi activ reduc ato induc cytotox liposom modifi use target ligand e selectin bind peptid prepar co deliv ato cur dysfunct endotheli cell ec overexpress e selectin molecul involv inhibit adhes e selectin intercellular cell adhes molecule icam inflamm il monocyt chemotact protein mcp human aortic endotheli cell evalu use real tim quantit pcr flow cytometri immunofluoresc stain antiatherosclerosi effect liposom co load ato cur vivo evalu use apo knockout apoe mice target liposom deliv ato cur dysfunct ec result synergist suppress adhes molecul e selectin icam plasma lipid level moreov treatment reduc foam cell format secret inflammatori factor il mcp block monocyt migrat intima addit cur success reduc ato induc cytotox vitro vivo experi demonstr cell target co deliveri ato cur dysfunct ec drastic reduc atherosclerot lesion fewer effect ato cur alon
37;postexposur prophylaxi pep hepat hepa vaccin immun globulin ig effect prevent infect hepat viru hav administ week exposur preexposur prophylaxi hav infect administr hepa vaccin ig provid protect unvaccin person travel work countri high intermedi hav endem advisori committe immun practic acip hepat vaccin work group conduct systemat review evid administ vaccin pep person age year review hepa vaccin efficaci safeti infant benefit protect hav intern travel februari acip recommend updat supersed previou acip recommend hepa vaccin pep intern travel current recommend includ hepa vaccin administ person age month pep addit hepa vaccin ig administ person age year depend provid s risk assess acip recommend hepa vaccin administ infant age month travel outsid unit state protect hav recommend travel rel dose infant age month count routin dose seri dosag ig updat applic ml kg hepa vaccin pep provid advantag ig includ induct activ immun longer durat protect eas administr greater accept avail
43;caus dispar biodivers region fundament question biogeographi ecolog evolutionari biolog evolutionari biogeograph process speciat extinct dispers directli determin speci rich pattern studi use integr phylogenet approach howev strikingli high rich east asia rel northern hemispher region remain poorli understood perspect here time test gener hypothes older colon time faster diversif rate explain pattern use plant tribe lysimachiea primulacea model system gener new time calibr phylogeni lysimachiea gene speci estim colon time diversif rate region test rel import factor explain region rich pattern time diversif rate explain rich pattern region lysimachiea instead new index combin factor explain global rich pattern group high east asian biodivers base result lysimachiea suggest high rich plant east asia explain combin older colon time faster diversif rate region
45;increas global atmospher nitrogen n deposit consider impact soil respir differ carbon dioxid co resourc differ compon soil respir differ mechan soil respond n addit aim studi investig effect n addit total soil respir rst rhizospher respir rsr heterotroph respir rsh elucid potenti causal mechan artifici n addit experi conduct evergreen broad leav forest western edg sichuan basin china effect n treatment level kg n ha yr measur n applic initi april trench method use partit rst rst rsr valu rst compon measur monthli april mean annual rst μmol co m s rsh rsr contribut rst respect nitrogen addit significantli reduc rst compon contribut rsr rst microbi biomass carbon c ph bulk soil decreas significantli n applic nitrogen addit effect rhizospher soil biochem properti rsr significantli posit correl root biomass castanopsi platyacantha rsh significantli posit correl concentr microbi biomass c mbc microbi biomass n mbn bulk soil posit correl rsr root biomass indic n applic reduc rsr reduc belowground c alloc c input rhizospher valu rsh decreas primarili reduct microbi activ soil organ matter decomposit root fre soil n ad presenc plant root mitig effect n input rhizospher alter root morpholog exud
46;coronaviru diseas covid report wuhan china decemb spread global result confirm covid case worldwid march singapor adopt multiprong surveil strategi includ appli case definit medic consult trace contact patient laboratory confirm covid enhanc surveil differ patient group all patient pneumonia hospit patient intens care unit icu possibl infecti diseas primari care patient influenza lik ill death possibl infecti etiolog allow clinician discret i e option order test base clinic suspicion case definit met identifi covid patient contain measur includ patient isol quarantin activ monitor contact border control commun educ precaut perform minim diseas spread march total covid case identifi singapor report analyz covid patient singapor determin effect surveil contain measur covid patient classifi primari mean detect applic case definit contact trace identifi patient detect enhanc surveil identifi laboratori test base provid clinic discret effect measur assess calcul day move averag interv symptom onset isol hospit quarantin indic signific decreas trend local import covid case rapid identif isol case quarantin close contact activ monitor contact effect suppress expans outbreak implic countri experienc outbreak
47;biotroph fungu ustilago maydi caus smut diseas maiz zea may character immens plant tumour establish diseas reprogram organ primordia tumour u maydi deploy effector protein organ specif manner howev cellular contribut leaf tumour remain unknown investig leaf tumour format tissue cell type specif level cytolog metabolit analysi deploy understand cellular basi tumourigenesi laser captur microdissect perform gain cell type specif transcriptom u maydi tumour format vivo visual plant dna synthesi identifi bundl sheath cell origin hyperplas tumour cell mesophyl cell hypertroph tumour cell cell type specif transcriptom profil u maydi reveal tailor express fungal effector gene moreov u maydi see identifi cell type specif fungal effector requir induct cell cycl reactiv bundl sheath cell identif distinct cellular mechan differ leaf cell type see effector induct prolifer bundl sheath cell major step understand u maydis induc tumour format moreov cell type specif u maydi transcriptom data valuabl resourc scientif commun
48;radium ra prolong surviv improv qualiti life men metastat castration resist prostat cancer mcrpc bone howev compar mcrpc therapi use ra come uniqu challeng henc aim identifi ra util pattern real world condit factor predict treatment complet outcom retrospect chart analysi mcrpc patient identifi receiv ra outsid clinic trial access program januari octob cancer centr ontario main outcom studi ra complet rate reason earli treatment discontinu overal surviv surviv differ patient complet ra therapi versu patient receiv cycl ra addit patient diseas characterist analys identifi predictor treatment complet surviv cohort patient pretreat abirateron and or enzalutamid half receiv docetaxel ra complet rate actuari median surviv month main reason earli ra discontinu diseas progress ra non complet associ poorer outcom median surviv month versu month men complet ra p lymph node metastas high baselin prostate specif antigen psa independ predictor earli treatment discontinu multivari cox proport hazard model reveal earli ra discontinu baselin anemia high psa prior skeletal rel event viscer metastas refer centr ra therapi predictor wors outcom despit lower complet rate observ clinic trial condit real world result achiev ra encourag prospect valid predict patient diseas characterist identifi cohort instrument identifi mcrpc patient like complet benefit ra therapi
52;visual signal attract friend attract enemi bright color anther pollen gener thought attract pollin hypothes visual crypsi anther particularli pollen favor flower plant protect pollen collector reduc loss male gamet understand adapt strategi relat color pollen measur color pollen undehisc anther sac background corolla spectromet insect pollin flower speci natur commun hengduan mountain southwest china color anther pollen corolla divers speci color divers expos pollen significantli higher conceal pollen i e anther enclos shield corolla color contrast pollen corolla significantli smaller speci expos pollen conceal pollen unlik anther color expos pollen color tend match background corolla color phylogenet compar analysi show contrast effect pollen color pattern flower expos pollen conceal pollen reveal strategi hide pollen pollen thiev visual crypsi
58;human malign result overexpress constitut activ receptor non receptor tyrosin kinas ultim lead mediat key tumor driven pathway tyrosin kinas ie egfr fgfr pdgfr vegfr aberrantli activ common tumor includ leukemia glioblastoma gastrointestin stromal tumor non small cel lung cancer head neck cancer iclusig ponatinib previous known ap oral activ multi tyrosin kinas inhibitor current approv food drug administr patient chronic myeloid leukemia philadelphia chromosome posit acut lymphoblast leukemia specif target bcr abl gene mutat t i ponatinib s uniqu multi target characterist studi demonstr abil target import tyrosin kinas fgfr pdgfr src ret kit flt human malign review focus avail data ponatinib molecular target treatment variou cancer discuss broader potenti agent cancer indic
61;make research respons research outcom meaning necessari commun research involv relev stakehold possibl especi application oriented includ inform commun technolog ict research nowaday stakehold engag fundament import project success achiev expect impact mandatori third parti fund context ultim research develop success peopl react posit result benefit gener project wider accept research outcom essenti public awar opportun discuss result research undertaken two way commun interperson commun research respons research innov rri approach anticip assess potenti implic societ expect regard research innov aim foster inclus sustain research innov research innov process need respons adapt grand challeng impli thing introduct broader foresight impact assess new technolog anticip market benefit risk therefor articl provid structur workflow explain how develop stakehold engag plan step step
68;gender differ career path medic graduat persist global aim explor impact domest tether career path physician studi gender differ domest burden physician differ percept impact domest work profession advanc web bas survey includ question sent physician alumni academ medic school lebanon data collect novemb januari invit remind overal includ final analysi women men studi respons rate find greater percentag men marri children vs p vs respect major women men held full tim posit have children reduc odd significantli or ci p for women older age reduc men or ci p full tim physician men women spent similar time profession activ hrs wk vs hrs wk p women spent time parent household work hrs wk vs hrs wk hrs wk vs hrs wk p respect women physician spous contribut hours week total time domest activ men physician spous spent fold time domest activ hours week p physician children higher percentag women men report children prevent career advanc particip develop opportun vs p vs p respect greater percentag women men scale career child vs married partn physician fewer women men report career took prioriti partner s conflict aros vs p find highlight heavier impact domest tether career path women physician men physician men like women hold full tim posit earli advanc defin phase career full tim women shoulder domest work men experi profession advanc concess close persist gender gap medicin requir address inequ domest burden strategi includ mentorship domest tether support on sit child car advocaci parent leav polici encourag share care work
