189;studi aim explor underli mechan shenyankangfu tablet sykft treatment glomerulonephr gn base network pharmacolog machin learn molecular dock experiment valid activ ingredi potenti target sykft obtain tradit chines medicin system pharmacolog databas analysi platform target gn obtain genecard etc perl cytoscap use construct herb act ingredient target network then clusterprofil packag r use gene ontolog go kyoto encyclopedia gene genom kegg pathway analysi use string platform cytoscap construct protein protein interact ppi network swisstargetpredict server predict target protein core activ ingredi base machine learn model molecular dock analysi perform use autodock vina pymol final verifi effect sykft gn vivo total activ ingredi target sykft screen target identifi relat gn enrich analysi indic biolog process primarili associ oxid stress cell prolifer kegg pathway analysi show target involv infection rel gn relat pathway ppi network analysi identifi core target sykft result machine learn model suggest stat akt key target result molecular dock suggest main activ compon sykft combin variou target protein vivo experi confirm sykft allevi renal patholog injuri regul core gene reduc urinari protein studi demonstr time multicompon multitarget multipathway characterist sykft gn treatment
191;paper investig power migrat mechan transmiss social norm take mali femal genit mutil fgm case studi mali strong fgm cultur long stand histori migrat use origin household level databas coupl censu data analyz extent girl live local high rate return migrant prone fgm malian migrat predominantli african countri femal circumcis uncommon e g côte d ivoir countri fgm total ban franc develop countri anti fgm inform campaign frequent target african migrant take two step instrument variabl approach control endogen migrat return decis return migrant neg signific influenc fgm practic precis result primarili driven flow returne cote d ivoir adult live local return migrant inform fgm favor legisl impact returne occur channel includ composit effect chang return migrant attitud fgm return migrant convinc stayer chang fgm practic
199;evalu dynam earli serum tumour marker stm neutrophil to lymphocyt ratio nlr predict clinic efficaci prognosi advanc non small cel lung cancer nsclc patient receiv program cell death pd program cell death ligand pd l inhibitor retrospect review patient advanc nsclc treat pd pd l inhibitor septemb august nlr stm routin measur immunotherapi initi radiolog evalu combin score base lead stm nlr dynam chang establish effect lead stm chang nlr chang combin score object respons rate orr durabl clinic benefit dcb progression fre surviv pf overal surviv os analys accuraci combin score evalu receiv oper characterist roc curv area curv auc overal patient includ retrospect cohort studi orr dcb median os pf month respect patient low combin score significantli improv orr dcb compar intermedi high score p orr p dcb multivari model combin score independ indic pf p os p auc demonstr combin score auc greater predict power posttreat nlr auc lead stm chang auc alon easi cost effect novel combin score base dynam earli stm nlr accur predict clinic efficaci pd pd l inhibitor prognosi advanc nsclc patient
200;consolid natur corpor sustain report mask evolut organ sustain initi thu fulli understand environment perform organ essenti examin experi specif project relat corpor sustain base case studi green project differ organ difficult determin environment impact project priori case environment consider includ initi project scope instead decis integr environment favor element project dynam occur interact compet institut logic organiz ident creat window opportun individu agenc window individu engag reinforc microprocess support tradit practic invok enabl microprocess facilit green decision mak consist ecosystem logic process model develop paper provid new perspect tempor contextu dimens environment championship behavior shed light puzzl result organ strong environment orient continu struggl deliv project strong posit environment impact
202;earlier report summar crop yield loss variou north american region weed left uncontrol offer report current wssa weed loss committe potenti yield loss weed base data collect variou region unit state canada dri bean yield loss estim compar dri bean yield weedi control plot weed control research studi conduct dri bean grow region unit state canada year period result field studi show dri bean grower idaho michigan montana nebraska north dakota south dakota wyom ontario manitoba potenti lose averag dri bean yield respect equat monetari loss million respect best agronom practic use weed manag tactic base censu data averag yield loss north america uncontrol weed dri bean product unit state canada reduc kg valu approxim million respect studi document dramat yield monetari loss dri bean weed interfer import continu fund weed manag research minim dri bean yield loss
208;recent advanc single molecule bas superresolut microscopi possibl visual biolog structur unpreced spatial resolut determin spatial coorgan structur cell physiolog patholog condit import biolog goal goal stymi current limit carri superresolut microscopi multipl color here develop approach simultan multicolor superresolut imag reli sole fluorophor excit fluoresc emiss properti modul intens excit laser differ frequenc color channel determin base fluorophor s respons modul excit use frequenc multiplex reduc imag acquisit time multicolor superresolut dna paint maintain advantag minim color cross talk minim photobleach maxim signal throughput abil maintain fluorophor densiti imag color abil use camera field view refer imag modal frequenc multiplex dna paint fm dna paint short frequenc multiplex fulli compat storm superresolut imag term fm storm unlik fm dna paint fm storm prone color cross talk overcom caveat develop machine learn algorithm correct color cross talk accuraci need prior inform imag structur
209;sever acut respiratori syndrom coronaviru sars cov identifi china decemb determin coronaviru diseas covid viru present itali earlier autochthon covid case diagnos uncertain aim identifi anti sars cov antibodi sera collect th novemb th march order assess possibl spread viru itali earlier offici nation diagnosi anti sars cov antibodi evalu retrospect serum sampl patient liver diseas hep pati blood donor bd use rapid serolog test confirm valid chemoluminesc assay rapid test igg posit igm posit case hep pati group two igg posit igm posit case detect bd group chemoluminesc confirm igg posit hep pati bd igm posit hep pati rnaemia detect subject render risk transfus transmiss neglig result suggest earli circul sars cov itali covid case describ china rapid test multipl benefit howev confirm assay requir avoid fals posit result
211;emerg nanotechnolog key enabl technolog past year open avenu new innov applic nanomedicin busi aspect nanomedicin market estim worth usd billion percept market growth usd billion despit opportun underli challeng futur engin nanomateri enm nanomedicin research signific obstacl bring enm clinic stage challeng includ capabl design bias fre method evalu enm toxic lack suitabl detect inconsist character techniqu therefor literatur review state of the art engin nanomateri nanomedicin toxicolog issu work framework develop toxicolog benchmark technic character techniqu determin toxic enm report literatur explor
212;inabl cd effector t cell teff reach tumor cell import aspect tumor resist cancer immunotherapi recruit cell tumor microenviron tme regul integrin famili adhes molecul express t cell here hp small molecul activ lymphocyt function associ antigen lfa late activ antigen vla integrin cell adhes receptor facilit preferenti local tumor specif t cell tumor improv antitumor respons hp monotherapi modest effect anti program death resist anti pd resist tumor combinatori treatment anti cytotox t lymphocyte associ protein anti ctla increas cd teff intratumor sequestr synerg cooper neutrophil induc cancer regress hp intratumor cd teff enrich activ depend cxcl analyz gene express profil use rna baselin treatment tumor sampl melanoma patient identifi baselin cxcl gene express possibl improv likelihood respons anti ctla therapi result provid proof of principl demonstr lfa activ convert t cell exclusionari tme t cell enrich tme mechan involv cooper innat immun cell
213;intern consensu cardiopulmonari resuscit emerg cardiovascular care scienc treatment recommend advanc life support includ updat multipl advanc life support topic address differ type review topic priorit basi recent resuscit commun new evid avail previou review systemat review address higher prior topic includ double sequenti defibril intraven versu intraoss rout drug administr cardiac arrest point of car echocardiographi intra arrest prognost cardiac arrest caus pulmonari embol postresuscit oxygen ventil prophylact antibiot resuscit postresuscit seizur prophylaxi treatment neuroprognost new updat treatment recommend topic present scope review conduct anticipatori charg monitor physiolog paramet cardiopulmonari resuscit topic systemat review new consensus scienc treatment recommend complet summar here remain topic review address evid updat identifi new evid help determin topic highest prioriti systemat review year
215;mating fertil success fecund influenc sexual interact individu natur frequenc vari differ environ extent local adapt adult fit compon poorli understood allow popul drosophila melanogast independ evolv mate environ alter sexual interact involv enforc monogami permit polygami structur simpl standard fli vial larger cage ad complex adult male femal reproduct fit measur gener respect reciproc transplant male reciproc local adapt observ monogami simpl polygami treatment consist evolut reproduct competit male polygami perform poorli monogami harm mate howev male evolv complex polygami treatment perform similarli better male mate environ consist previou result show higher genet qualiti treatment differ femal fit mute suggest select femal diverg mate treatment echo common pattern greater phenotyp express diverg male femal
218;transpos temper phage randomli insert bacteri genom provid increas suppli alter spectra mutat avail select open altern evolutionari trajectori transpos phage acceler bacteri adapt new environ effect adapt social environ unclear use experiment evolut pseudomona aeruginosa iron limit iron rich environ cost produc cooper iron chel siderophor high low respect transpos phage promot diverg extrem siderophor product phenotyp iron limit popul transpos phage evolv siderophor overproduc clone alongsid siderophor non produc cheat low siderophor product associ parallel mutat pvd gene encod pyoverdin biosynthesi pq gene encod quinolon signal high siderophor product associ parallel mutat phenazine associ gene cluster notabl parallel mutat caus phage insert inactiv data suggest transpos phage widespread microbi commun mediat evolutionari diverg social strategi
219;mitochondri plastid genom land plant exhibit slowest rate sequenc evolut observ eukaryot genom suggest except abil prevent correct mutat howev mechan respons extrem fidel remain unclear test seven candid gene involv cytoplasm dna replic recombin repair polia polib msh reca ung fpg ogg effect mutat rate model angiosperm arabidopsi thaliana appli highli accur dna sequenc techniqu duplex sequenc detect newli arisen mitochondri plastid mutat low heteroplasm frequenc disrupt msh but candid gene lead massiv increas frequenc point mutat small indel chang mutat spectrum mitochondri plastid dna use droplet digit pcr transmiss novo heteroplasmi gener msh mutant confirm contribut herit mutat rate dual target gene enigmat lineag mut mismatch repair famili present outsid green plant multipl eukaryot group stramenopil alveol haptophyt cryptomonad certain bacteria virus msh previous shown limit ectop recombin plant cytoplasm genom result point broader role recognit correct error plant mitochondri plastid dna sequenc lead greatli suppress mutat rate initi double strand break repair pathway base faith homolog recombin
224;tumor associ macrophag tam affect cancer progress therapi ovarian carcinoma metastas periton caviti here periton macrophag subset mice bear id ovarian cancer base t cell immunoglobulin mucin domain contain tim express tim tam embryon origin local sustain tim tam replenish circul monocyt tim tam tim tam promot tumor growth vivo rel tim tam tim tam manifest high oxid phosphoryl adapt mitophagi allevi oxid stress high level arginase tim tam contribut potent mitophagi activ weaken mtorc activ low arginin result arginase medi metabol furthermor genet defici autophagi element fak family interact protein kda result tim tam loss ros medi apoptosi elev t cell immun id tumor inhibit vivo moreov human ovarian cancer associ macrophag posit complement receptor immunoglobulin superfamili crig transcript metabol function similar murin tim tam thu target crig tim tam potenti treat patient ovarian cancer periton metastasi
225;yang sun di long depart orthopaed affili central hospit shenyang medic colleg shenyang peopl s republ chinacorrespond yang sun email sunyang combackground present work effort develop novel local inject lvtt load plga microspher lvtt plga m treatment rabbit femor head necrosi fhn method lvtt load plga microspher lvtt plga ms prepar emulsion solv evapor method physicochem properti lvtt plga m investig ensur good qualiti suitabl local deliveri vitro drug releas behavior ms studi compar free lvtt vivo studi pharmacokinet pharmacodynam ms rabbit optim formulation result studi use emulsion solv evapor method prepar lvtt plga ms scan electron microscopi demonstr lvtt plga ms regular round shape rel unifi size distribut select mean ps μm drug load rate calcul batch ms thermogram lvtt plga ms show endotherm peak c reveal lvtt exist ms uncrystal crystal form releas studi lvtt plga ms observ linear prolong drug releas rate day initi burst releas pharmacodynam result confirm lvtt plga ms good last improv effect femor head necrosis conclus result demonstr lvtt plga ms potenti local deliveri system keyword lovastatin plga microspher vitro in vivo
226;wang althoff explor capac drosophila melanogast exhibit adapt plastic novel environ full sib half sib design score activ enzym alcohol dehydrogenas adh plastic respons measur chang adh activ ethanol concentr rang natur variat the novel environ adh activ increas alcohol concentr posit associ larval viabil adh activ novel environ report famili exhibit greater plastic higher larval surviv novel environ conclud adh plastic adapt howev author concur that studi estim plastic phenotyp differ environ use full sib famili possibl disentangl contribut allel frequenc chang adh locu regulatori control loci known influenc adh activ select chang allel frequenc conflat estim plastic type plastic adapt neutral maladapt infer depend allel frequenc problem score sib group select consid plastic studi use replic genotyp research monitor chang allel frequenc mechan deal issu
231;sexual harass sh preval militari set depend workplac environ studi investig issu non u militari set examin contextu individu factor relat militari sexual trauma mst vari gender studi draw nation sexual survey french militari includ servicemen servicewomen examin sexual stressor repeat sexual comment sexual coercion repeat unwant verbal sexual attent sexual assault sa combin measur verbal sh comment unwant attent mst all form conduct multivari logist regress identifi contextu individu factor relat outcom women men experienc mst year report sa factor associ verbal sh differ relat sa odd verbal sh elev men sex men or women offic or odd sa elev men year or women high school diploma or odd sh increas men work unit higher femal represent higher preval mst sexual comment sexual assault coercion repeat unwant attent lower accept women miliatri odd sa increas men work unit higher femal represent higher preval sexual oppress odd sa women particular high or unit high preval sexual assault coercion repeat unwant attent mst common french militari women experienc sever form men resul programmat action reduc workplac factor relat verbal sh sa french militari
234;dog bite studi typic base hospit record bias bite requir signific medic treatment studi investig true dog bite preval incid community level victim rel risk factor order inform polici prevent cross sect studi commun household cheshir uk survey respond household data includ dog ownership bite histori demograph health person ten item person inventori tipi brief measur multivari logist regress model risk factor have bitten dog account cluster individu household quarter particip ci report have bitten dog lifetim bite describ requir medic treatment hospit admiss incid dog bite popul year male time like bitten lifetim femal ci p current owner multipl dog time like ci p report have bitten peopl current own dog regard bite describ commonli peopl bitten dog met incid individu score higher emot stabil lower risk have bitten or point chang scale ci p studi suggest real burden dog bite consider larger estim hospit record further bite requir medic treatment hospital bas bite data repres bite wider popul victim person requir investig potenti consider design bite prevent scheme
235;neutrophil percentage to albumin ratio npar system inflammation bas predictor associ diseas outcom nevertheless studi relationship npar inflammatori marker importantli prognost valu npar critic ill patient cardiovascular diseas cvd remain unknown data retrospect cohort studi medic inform mart data intens care iii databas mimic iii second affili hospit wenzhou medic univers linear regress logist regress model cox regress model use assess associ npar level length stay renal replac therapi rrt use day day one year mortal respect pearson correl coeffici use present correl npar c reactiv protein crp studi includ patient mimic iii patient second affili hospit wenzhou medic univers elev npar independ associ increas day day one year all caus mortal adjust hr ci p trend respect associ increas length stay hospit icu β ci respect p trend patient higher npar like receiv rrt or ci p trend moreov confirm npar statist posit correl crp correl coeffici r p elev npar admiss independ associ increas all caus mortal length stay cicu patient result show cicu patient higher npar like receiv rrt besid provid evid posit correl npar inflammatori indic ie crp
237;rel littl known immigr settlement experi small mid siz canadian citi includ access local servic hous experi outcomes both key factor success integr studi consid immigr settlement experi includ access local servic hous experi outcom citi kelowna kamloop focu hous rental market relianc commun servic result studi includ recommend improv immigr settlement integr urban area interior british columbia survey data gather april august recent immigr renter citi kelowna kamloop find suggest immigr hous difficult anticip larg unexpectedli high cost unfamiliar canadian hous system immigr citi reli local commun organ government sponsor one place live and or job arriv kelowna kamloop did help immigr reli famili friend initi assist prefer receiv inform prior arriv recommend settlement hous servic offer direct assist new immigr polici succeed attract retain immigr citi british columbia s interior depend presenc a subsidized afford hous b job opportun match immigr qualif offer adequ incom c qualiti servic program integr new immigr commun
238;ecolog wildlif live proxim human differ natur place anim perceiv anthropogen featur peopl threat exhibit avoid behavior acclim human activ develop expand global chang ecolog speci respons human phenomena determin anim persist chang environ hypothes american black bear ursu americanu persist develop area effect avoid riski landscap featur test quantifi chang movement adult femal popul live exurban suburban develop collect hourli gp data individu use step select function estim select anthropogen featur femal avoid road highway cub respons increas traffic volum bear occupi greater hous densiti select hous increas avoid road respons traffic increas behavior flexibl allow bear highli develop area alter select avoid anthropogen featur season find support hypothesi black bear perceiv human activ riski effect avoid risk inhabit develop area document high individu variat select anthropogen featur studi popul find suggest initi wildlif success inhabit develop landscap effect avoid human activ howev variat individu provid capac population level shift behavior time
242;compar structur presence abs i e binari matric random counterpart common practic ecolog howev differ random procedur null model affect result comparison lead matrix structur pattern appear random not subject choic particular null model make advis compar result obtain use differ approach yet avail algorithm random binari matric differ substanti respect constraint impos discrep observ random row column margin total complic interpret contrast pattern call new strategi explor intermedi scenario restrict in between extrem constraint assumpt properli synthes result inform introduc new model framework base flexibl matrix random algorithm name tune peg algorithm address issu algorithm consist modifi swap procedur discrep row column margin total target matrix random counterpart tune continu way paramet control respect row column discrep combin tune peg wise random walk procedur make possibl explor complet null space embrac exist algorithm explor allow research visual matrix structur pattern innov bi dimension landscap significance effect size demonstr ration potenti approach set simul real matric show simultan investig comprehens continu portion null space extrem inform possibl key resolv longstand debat analysi ecolog matric
245;enrofloxacin use treatment wide varieti bacteri infect mammal howev poor solubl limit clinic use order improv solubl enrofloxacin enrofloxacin mesyl em obtain chemic synthesi method character em carri use ultraviolet scan uv synchron thermal analysi sdt fourier transform infrar spectromet ftir mass spectrometri ms nuclear magnet reson nmr x ray powder diffract analysi xrpd acut toxic em kunm mice studi besid pharmacokinet studi perform new zealand rabbit singl oral dose mg kg antibacteri activ em evalu em success synthes purifi stoichiometr ratio mesyl enrofloxacin aqueou solubl em mg ml solubl em time higher enrofloxacin oral lethal dose ld em mg kg pharmacokinet indic oral rel bioavail em time time higher enrofloxacin enrofloxacin hydrochlorid respect addit vitro antibacteri activ em significantli chang compar enrofloxacin enrofloxacin hydrochlorid em higher solubl low toxic oral use increas oral bioavail rabbit studi benefit develop new enrofloxacin drug
246;paper report new research time natur post glaci environment chang lake flixton north yorkshir uk previou investig indic success wetland environ earli holocen ultim infil basin ca cal bp expans wetland environ earli holocen woodland develop link chang human occup landscap mesolith ca cal bp howev understand time natur environment chang palaeolak poor make difficult correl known pattern mesolith activ paper provid new record chronolog charact environment chang lake flixton discuss implic mesolith occup surround landscap
247;background increas zoonot diseas research use livestock belong tradit livestock keeper lk research subject care attent anim livestock keeper interest critic import zambia similar context method studi aim explor ethics rel challeng zoonot diseas research lk livestock includ research subject studi implement southern provinc zambia juli focu group discuss fgd involv adult male lk live livestock wildlif interfac area zoonot diseas like occur carri out fgd local languag audio record themat analysi use field note translat transcrib record interview result studi trust research lk livestock use research subject cardin depend continu presenc local veterinari assist va conduct research conclus lk consid vulner popul livestock use research subject as resourc poor look research provid benefit fulli understand research did worri consent procedur bring question valid oral consent obtain studi opportun strengthen trust enhanc research experi exploit research conduct research local relev desir awar procedur prefer enter livestock keep commun adequ disclosur research procedur respect convent tradit cultur belief return result research find studi use research carry out zoonot diseas research research ethic committe
251;protein compris domain limit suit protein famili domain rearrang variou combin gene fusion event evolv new protein function includ acquisit protein allosteri incorpor regulatori domain enzym deoxy d arabino heptuloson phosphat synthas dah p enzym aromat amino acid biosynthesi display divers rang alloster mechan dah pss adopt common architectur share β α catalyt domain attach act lik chorism mutas regulatori domain oper distinct mechan respect domain confer alloster regul control dah p function respons ligand tyr prephen start contemporari dah p protein protein chimera creat interchang regulatori domain engin protein catalyt activ deliv new function allosteri switch ligand specif alloster mechan deliv nonhomolog regulatori domain interchang protein domain repres effici method engin allosteri multidomain protein creat new bifunct enzym
