370;nanocarri technolog effect appli develop drug deliveri system overcom limit tradit prepar applic extend variou pharmaceut field inject prepar oral prepar extern prepar appear field cosmet beauti applic widespread influenc nanocarri cosmet industri fact nanocarri effect promot percutan penetr significantli increas skin retent activ compon function cosmet meanwhil nanocarri effect improv water dispers insolubl activ cosmet ingredi enhanc stabil efficaci compon achiev codeliveri divers cosmet activ ingredi review summar current progress nanocarri technolog function cosmet includ type rout dermal transderm drug deliveri nanocarri use function cosmet mechan nanocarri promot percutan penetr activ cosmet ingredi applic efficaci evalu differ activ cosmet ingredi nanocarri discuss potenti risk human provid use refer develop nanocarri field function cosmet
371;investig effect school race ethn enrol mental health earli adolesc examin race ethn densiti percent non latinx nl white enrol divers range s race ethn group enrol variat student race ethn ident examin minor stressor uniqu experienc race ethn minor student longitudin cohort broader mental health studi fourteen school texa sixth grad particip mean age year link publicli avail data school n self report depressive anxi symptom two year period gener estim equat test main effect density divers depressive anxi symptom student report race ethn ident adjust student school factor owe statist signific latinx group differ accultur stress uniqu ident gener nl black low stress latinx high stress latinx nl white refer point converg student mental health profil density divers explor signific interact densiti student race ethn p nl black low stress latinx vs nl white student experienc higher symptom two year period net covari contrast greater divers associ higher symptom net control p margin signific interact p reveal fewer symptom high stress latinx vs nl white student nl white densiti divers student experienc similar mental health profil greater nl white densiti increas mental health risk nl black low stress latinx student school divers lower risk high stress latinx student find demonstr educ set produc lessen minor stress
375;compound extrem cooccur soil drought low soil moistur atmospher arid high vapor pressur deficit disastr natur societ system soil drought atmospher arid main physiolog stressor drive widespread veget mortal reduc terrestri carbon uptak here empir demonstr strong neg coupl soil moistur vapor pressur deficit occur global indic high probabl cooccur soil drought atmospher arid use global land atmospher coupl experi glace cmip experi concurr soil drought atmospher arid greatli exacerb land atmospher feedback feedback soil drought atmospher larg respons enabl atmospher arid extrem addit soil moisture precipit feedback act amplifi precipit soil moistur deficit region cmip model frequenc concurr soil drought atmospher arid enhanc land atmospher feedback project increas st centuri importantli land atmospher feedback greatli increas intens soil drought atmospher arid expect chang mean climat alon
376;increas evid demonstr microrna regul develop cartilag osteogenesi mir particip develop human articular cartilag remain larg unknown studi aim investig role mir human chondrocyt express mir initi assess human osteoarthr oa tissu articular chondrocyt quantit real tim polymeras chain reaction effect mir prolifer apoptosi human chondrocyt assess dimethylthiazol yl diphenyltetrazolium bromid mtt annexin v fluorescein isothiocyan fitc propidium iodid pi doubl stain assay then effect mir type ii collagen alpha col a aggrecan runt rel transcript factor runx matrix metalloproteinase mmp examin quantit real tim polymeras chain reaction western blot analysi mir significantli increas human oa tissu chondrocyt mir significantli inhibit prolifer chondrocyt promot apoptosi express col a aggrecan dramat decreas express runx mmp significantli increas mir overexpress mir particip cartilag degrad oa manipul express mir human chondrocyt novel therapeut strategi treatment oa
381;reproduc key tenet scientif process dictat reliabl gener result method complex ecolog observ data present novel challeng satisfi need reproduc transpar ecolog system dynam heterogen interact numer factor sculpt natur histori investig complet control observ highli depend spatial tempor context make difficult reproduc comput reproduc achiev comput reproduc refer abil produc equival analyt outcom data set use code softwar origin studi code workflow share author editor provid transpar reader allow research build directli effici primari work qualiti especi import ecolog applic import controversi implic scienc manag polici expect comput reproduc transpar shift rapidli scienc work highlight uniqu challeng ecolog practic guidelin reproduc transpar ecologist continu particip stewardship critic environment inform ensur research method demonstr integr
385;trauma rel cognit self world identifi mediat posttraumat stress disord ptsd chang prolong exposur pe therapi howev extent neg cognit mediat ptsd chang ptsd treatment unclear addit previou studi test altern mediat ptsd chang pe sampl treatment seek active duti militari personnel ptsd present studi examin specif neg cognit mediat effect pe present cent therapi pct addit examin possibl mediat cognit emot regul lag mediat analys indic neg cognit self world unhelp cognit emot regul strategi catastroph significantli mediat chang ptsd baselin month follow up combin model mediat effect catastroph greater neg cognit world similar neg cognit self moder mediat analys reveal effect catastroph greater pe pct find trauma rel cognit and greater degre emot regul strategi catastroph mediat ptsd chang research need determin mediat variabl repres mechan therapeut chang
388;shown main caus damag waterwal tube middl radiant section mr dismantl washing and separ equip pk boiler and result ingress signific moistur transit zone mrp tube base analysi hydraul regim test result establish moistur enter mrp distribut extrem nonuniformli tube shown major moistur enter tube locat lower generatrix inlet header connect blind end damag concentr horizont section tube stratif steam wat mixtur cyclic temperatur fluctuat tube wall firesid lead destruct protect magnetit film steam wat corros measur develop improv reliabl mrp tube boiler whole
390;hepat c viru hcv major caus chronic liver infect million peopl infect worldwid pakistan second highest preval hcv infect half pakistani live spain resid barcelona aim studi analys seropreval viraem rate determin genotyp subtyp hcv pakistani live southern metropolitan area barcelona includ pakistani patient seek primari healthcar southern metropolitan area barcelona august juli serum sampl screen hcv antibodi hcv viral load determin revers transcript polymeras chain reaction genotyp subtyp perform use versant hcv genotyp and or deep sequenc screen hepat b viru hbv carri out pakistani patient screen anti hcv antibodi posit viral load determin present activ infect viraem rate confid interv hcv genotyp subtyp perform individu infect correspond hcv genotyp high resolut hcv subtyp perform sampl present subtyp a subject present hbv coinfect undetect hbv dna studi period identifi possibl case hcv vertic transmiss follow spontan viraemia clearanc chronic infect mother c t il b genet polymorph result suggest gener hcv screen protocol patient high preval countri pakistan help identifi treat activ hcv infect avoid transmiss contribut build target health polici micro elimin hcv infect specif commun
392;identifi relationship clinic assess chronic pain enabl gener multivari model predict patient satisfact spinal cord stimul sc treatment data exploratori clinic trial sub percept sc spsc review forty seven subject test multipl spsc program day each end program period subject record pain intens patient satisfact treatment pswt modifi patient global impress chang physic activ toler time outcom variabl evalu pearson s correl coeffici use assess pair wis correl multigener mix effect model perform creat model best explain relationship variabl final model gener predict pswt use even pain intens epi interact epi walk toler time mix effect model allow visual interact epi walk toler time patient satisfact sc patient cent outcom desir evalu complex multidimension health impair accur predict patient satisfact treatment remain challeng understand variabl predict either causat associ satisfact use clinician result studi suggest composit measur activ toler i e walk toler pain intens predict patient satisfact sc therapi studi highlight util composit outcom metric evalu benefit sc chronic low leg pain
397;patient multipl sclerosi ms increasingli demand access reliabl inform regard diseas object infoseek m studi assess strategi peopl ms use search inform diseas includ sourc frequenc reliabl prefer content non intervent cross sect studi conduct patient diagnosi ms accord mcdonald criteria includ infoseek questionnair use assess patient strategi seek inform diseas clinic characterist variabl includ disabl qualiti life fatigu cognit anxieti depress analys use expand disabl statu scale edss multipl sclerosi impact scale msis item modifi fatigu scale mfis symbol digit modal test sdmt hospit anxieti depress scale had respect patient studi mean age year femal mean diseas durat year relapsing remit ms mean edss score internet either mobil comput frequent report sourc inform lifestyle rel inform research emerg treatment symptom control share experi patient diseas prognosi search topic neurologist nurs trust sourc inform younger patient higher sdmt score associ search resourc m m respect frequenc search relat number relaps r edss r msis physic psycholog compon r invers depress r healthcar profession consid reliabl sourc inform peopl ms search inform internet frequent individu inform strategi consid differ factor involv need
406;effect β hydroxysteroid dehydrogenas type β hsd inhibit hepat steatosi incomplet understood here aim determin therapeut effect bvt select β hsd inhibitor hepat steatosi c b j mice randomli divid low fat diet lfd fed group high fat diet hfd fed group mice fed hfd week induc obes sever hepat steatosi group divid group follow lfd lfd bvt hfd hfd bvt mice lfd bvt hfd bvt group intraperiton inject bvt daili day effect bvt mice bodi weight serum lipid profil serum free fatti acid ffa glucocorticoid level gene express adipos liver tissu assess inject low dose bvt mg kg day reduc bodi weight hyperlipidemia did improv glucos toler insulin resist diet induc obes mice low dose bvt attenu hepat steatosi liver injuri liver lipolyt gene express diet induc obes mice besid low dose bvt reduc fat mass lipolysi viscer adipos tissu hepat ffa serum corticosteron level diet induc obes mice studi show moder inhibit β hsd bvt reduc ffa corticosteron synthesi fatti tissu attenu deliveri corticosteron ffa liver collect prevent high fat diet induc hepat steatosi
407;thyroid cancer tc endocrin diseas progress regul factor includ circular rna circrna howev new circrna role circ tc worth explor express level circ microrna mir mitogen activ protein kinas mapk assess quantit polymeras chain reaction q pcr circular characterist circ identifi oligo dt primer ribonucleas r rnase r actinomycin d actd local determin nuclear cytoplasm separ assay also cell prolifer detect coloni format assay cell migrat invas assess transwel assay further seahors xf extracellular flux analyz use measur oxygen consumpt rate ocr cell besid dual luciferas report rna immunoprecipit rip rna pull down assay use identifi mechan circ western blot wb analysi use test mapk protein level addit mice xenograft model construct test effect circ tc tumor growth vivo circ highli express tc stabl cyclic transcript mainli locat cytoplasm circ knockdown suppress prolifer migrat invas metabol abil tc cell mir absorb circ inhibit effect overexpress tc progress revers overexpressed circ mapk target mir suppress effect silenc tc progress invert mir inhibitor besid mapk express regul circ mir interfer circ reduc tc tumor growth vivo circ play carcinogen role tc progress regul mir mapk axi provid new idea treatment tc
409;feedback play vital role foster teacher self efficaci social comparison feedback valenc posit vs neg feedback assum larg impact self efficaci therefor pre servic teacher perceiv social comparison feedback valenc peer feedback extent pre servic teacher bachelor mast student teacher trainer incorpor comment impact self efficaci peer feedback merit investig studi conduct show peer feedback consist social comparison posit feedback valenc result greater willing improv posit affect second studi reveal teacher trainer feedback specif bachelor student feedback contain social comparison did master student teacher trainer futur research practic implic discuss
411;translat initi control protein synthesi regul deliveri aminoacyl trna messeng rna mrna eukaryot initi sophist requir dozen protein factor gtp regul step gtpase eif b gate progress elong second gtp regul step use electron cryomicroscopi cryo em imag vitro initi reaction set purifi yeast compon design stall eif b nonhydrolyz gtp analog high resolut reconstruct dead end intermedi å allow visual eif b ribosome bound conform identifi stretch residu eif b locat close γ phosphat gtp center univers conserv tyrosin saccharomyc cerevisia number contact catalyt histidin eif b h site direct mutagenesi confirm essenti role residu play regul ribosom bind gtp hydrolysi translat initi vitro vivo result illustr eif b transmit presenc properli deliv initi aminoacyl trna p site distant gtpase center interdomain commun underscor import multidomain architectur translat factor sens commun ribosom state
413;recent studi shown relationship triglycerid glucos tyg index risk stroke gener popul patient cohort howev role tyg index stroke risk elderli hypertens patient determin thu aim investig associ tyg index stroke ischem stroke elderli individu hypertens includ elderli subject hypertens china h type hypertens registri studi current analysi tyg index calcul ln fast triglycerid mg dl fast glucos mg dl outcom stroke ischem stroke median follow up year stroke diagnos patient ischem stroke diagnos patient multivari cox proport hazard model reveal tyg index posit associ risk stroke per unit increment hr ci ischem stroke hr ci tyg index assess quartil significantli higher risk stroke hr ci ischem stroke hr ci particip quartil compar quartil tyg index potenti use earli identif elderli hypertens patient high risk experienc stroke
414;cellular senesc import anticanc mechan restrict prolifer damag premalign cell cellular senesc play import role tissu remodel develop howev trade off associ cellular senesc senesc cell contribut age patholog nake mole rat nmr heterocephalu glaber longest liv rodent resist varieti age rel diseas remark nmr age phenotyp late stage live here test nmr cell undergo cellular senesc report nmr display development program cellular senesc multipl tissu includ nail bed skin dermi hair follicl nasopharyng caviti nmr cell underw cellular senesc transfect oncogen ra addit cellular senesc detect nmr embryon skin fibroblast subject γ irradi ir howev nmr cell requir higher dose ir induct cellular senesc nmr fibroblast resist ir induc apoptosi gene express analys senescence rel chang demonstr that similar mice nmr cell up regul senescence associ secretori phenotyp gene display profound down regul dna metabol transcript translat mous cell conclud nmr display type cellular senesc short liv rodent
415;speci invas major driver ecolog chang difficult control revers increas climat chang global trade invas scienc consid speci invad environ adapt scientist polici maker consid human adapt invas speci affect ecosystem well b address thi framework conceptualis autochthon human adapt invas develop base human adapt biodivers chang framework case studi metasynthesi result adapt occur differ sphere human activ organis differ social ecolog scale respons feedback sphere adapt invas driver set highli contextu complex non linear respons make pathway pursu time invas speci manag adapt occur from below polici plan control effort support autochthon adapt undermin it
418;self stigma result intern neg stereotyp affect person research self stigma substanc use disord sud scarc especi regard role childhood trauma subsequ posttraumat disord present studi investig progress model self stigma women sud posttraumat stress disord ptsd predict valu ptsd sever childhood trauma experi self stigma cross sect studi women sud ptsd use self stigma alcohol depend scale childhood trauma questionnair ctq ptsd symptom scale interview pss i control sud sever depress addict sever index lite beck depress inventory ii hierarch regress analys conduct stage self stigma aware agree apply harm interrel success stage self stigma larg confirm regress model signific effect pss i ctq score observ stage self stigma agre neg stereotyp sole predict younger age appli stereotyp oneself higher women younger age higher depress sud sever suffer applic harm predict depress progress model self stigma confirm women sud ptsd ptsd sever childhood trauma did directli affect process self stigma appear relat depress stronger way ptsd relat women sud ptsd
419;background long act muscarin antagonist lama long act β agonist laba mainstay mainten therapi chronic obstruct pulmonari diseas copd previou studi support inhal long act bronchodil ilab overal cardiovascular safeti risk specif cardiovascular outcom arrhythmia heart failur stroke unknown materi method systemat search pubm embas databas cochran librari publish studi ilab copd incept novemb languag restrict rr correspond ci pool evalu ilab placebo result final random control trial includ compar placebo ilab increas risk overal specif cardiovascular advers event ae contrari reduc incid hypertens rr ci i p howev stratifi accord specif agent ilab olodaterol reduc risk overal cardiovascular advers event oca rr ci i p protect effect low blood pressur disappear similarli use inhal laba increas risk cardiac failur rr ci i p risk disappear stratifi accord specif agent laba besid formoterol decreas risk cardiac ischemia rr ci i p conclus overal use ilab associ overal cardiovascular ae patient stabl copd stratifi accord specif agent laba olodaterol reduc risk oca formoterol decreas risk cardiac ischemia laba reduc incid hypertens increas risk heart failur therefor copd patient histori heart failur use caution
421;recess loss of funct mutat atp a park associ spectrum neurodegen disord includ parkinson s diseas pd recent reveal late endo lysosom transport atp a pump polyamin like spermin cytosol atp a dysfunct caus lysosom polyamin accumul ruptur here investig atp a provid protect mitochondri toxin rotenon environment pd risk factor rotenon promot mitochondrial gener superoxid mitoro exacerb atp a defici sh sy i cell patient deriv fibroblast disturb mitochondri function induc toxic cell death moreov atp a knockdown induc atf chop depend stress respons follow rotenon exposur mitoro atf chop block mitotempo mitochondri antioxid suggest impact atp a mitoro relat antioxid properti spermin pharmacolog inhibit intracellular polyamin synthesi α difluoromethylornithin dfmo increas mitoro atf atp a defici polyamin transport activ atp a requir lower rotenone dfmo induc mitoro exogen spermin quench rotenone induc mitoro atp a interestingli fluoresc label spermin uptak mitochondria drop consequ atp a transport defici cellular observ recapitul vivo caenorhabd elegan strain defici atp a ortholog catp anim exhibit basal elev mitoro level mitochondri dysfunct enhanc stress respons regul atfs c elegan ortholog atf caus hypersensit rotenon revers mitotempo togeth studi reveal conserv cell protect pathway counter mitochondri oxid stress atp a medi lysosom spermin export
422;meta studi articl publish conduct hispan access health care us studi includ accultur fewer role social capit import factor impact healthcar access popul includ factor confus defin operation accultur social capit serv overcom structur barrier place manifest stronger hispan rel newcom healthcar highli complex navig major studi includ systemat review literatur public health journal focu sociolog aspect much studi expos need expand worldview use literatur order enrich understand access health care hispan
423;provid conceptu review avail knowledg role human cognit bias sustain sustain behavior human cognit bias defin deviat decis make standard framework ration choic distinguish bias individu decis make bias group decis make highlight relev sustain behavior categori contribut unsustain behavior human cognit bias group set central understand current sustain issu moreov argu effect group rel bias outweigh individu level drive unsustain behavior bias discuss variou label literatur interpret manifest human cognit bias group set
426;sugar sweeten beverag ssb consumpt substanti increas success birth cohort adolesc young adult age year highest consumpt howev link ssb early onset colorect cancer eo crc remain unexamin nurs health studi ii prospect investig associ ssb intak adulthood adolesc eo crc risk women report adulthood beverag intak use valid food frequenc questionnair ffq year subset particip report beverag intak age year use valid high school ffq cox proport hazard model use estim rel risk rr ci document eo crc case compar individu consum serving week ssb adulthood women consum servings day doubl risk eo crc rr ci ptrend higher risk rr ci serving day increas serving day increment ssb intak age year associ higher risk eo crc rr ci replac serving day adulthood ssb intak artifici sweeten beverag coffe reduc fat milk total milk associ lower risk eo crc higher ssb intak adulthood adolesc associ higher risk eo crc women reduct ssb consumpt adolesc young adult serv potenti strategi allevi grow burden eo crc
429;health rel qualiti life qol defin patient s subject percept health insuffici data exist qol patient undergo hallux valgu hv oper use item short form survey sf measur qol patient aim evalu effect hv qol identifi qol determin patient underw surgeri hv includ studi sf questionnair appli patient surgeri patient medic record examin identifi possibl factor affect qol age gender bodi mass index durat symptom smoke mean age patient year patient women mean durat diseas year surgeri improv qol score gener health emot well b role limit person emot problem physic function bodili pain howev chang score vital social function statist signific lower postop qol score emot well b bodili pain significantli associ age durat symptom compar mean qol healthi adult turkish popul score subdimens lower studi show hv adult neg impact gener health bodili pain physic function physic emot well b social well b vital
431;ever peopl s live practic span nation border grow group individu tie welfar system lack mechan cater cross bord migrat produc friction nation welfar provis transnat client accommod transnat dynam nation welfar system adapt articl shed light norwegian experi thi explor norwegian social secur organis nav bureaucrat work challeng respond increasingli transnat popul present framework research transnat work nation welfar organis use analys micro meso macro scal process adapt analysi find transnat live long accommod bureaucrat specialis entrepreneurship current organis turnaround respond inject transnat dynam nation mainstream
433;understand predict other action ecolog set import research goal social neurosci here deploy mobil brain bodi imag mobi methodolog analyz inter brain commun profession musician live jazz perform specif bispectr analysi conduct assess synchron scalp electroencephalograph eeg signal expert musician three part minut jazz perform new musician join minut bispectrum estim musician dyad electrod combin frequenc band result show higher bispectrum beta gamma frequenc band hz musician perform togeth play music phrase synchron posit bispectrum amplitud chang approxim second prior identifi synchron perform event suggest preparatori cortic activ predict concert behavior action moreov higher synchron eeg activ electrod region observ musician perform inter brain synchron tempor pariet occipit region frequent increas synchroni musician brain activ reflect share multi sensori process movement intent music improvis task
434;serum amyloid saa acut phase inflammatori protein previous describ robust biomark colorect inflamm patient ulcer coliti uc clinic remiss howev induc saa express uc remain unclear studi demonstr saa significantli express intestin tract uc mous model compar c reactiv protein inflammatori biomark moreov interleukin tumor necrosi factor α promot saa express toll lik receptor ligand flagellin lipopolysaccharid furthermor result suggest nuclear factor kappa b nf κb pathway involv promot saa express flagellin inhibit treatment aminosalicyl acid asa therefor flagellin nf κb saa axi repres mechan asa suppress intestin inflamm
