0;object precari employ pe term use non standard employ form character low secur neg effect mental health object review systemat review evid effect pe mental health identifi import area research method protocol develop follow prisma p guidelin web scienc pubm psycinfo search septemb uniqu record assess elig qualiti review data includ studi summar forest plot meta analys use random effect model evid qualiti rate use grade method result obtain uniqu record studi suffici qualiti met inclus criteria moder qualiti evid grade score advers effect job insecur mental health summari odd ratio or confid interv ci low qualiti grade evid effect temporari employ unpredict work hour mental health studi multidimension exposur show advers effect weight averag ci conclus research pe mental health grow high qual prospect studi scarc job insecur like advers effect mental health clear multi dimension definit pe lack harmon effort need single vari observ studi job insecur temporari employ priorit
1;high parent self efficaci pse associ healthi diet higher level physic activ pa children howev data pse relat bodi weight bodi composit scarc object studi investig associ pse measur diet pa bodi composit physic fit earli childhood use baselin data ministop trial healthi swedish children n year pse assess use questionnair dietari data collect use mobil technology assist methodolog pa obtain sedentari behavior moderate to vigor accelerometri bodi composit measur use pediatr option bodpod cardiorespiratori fit m shuttl run linear regress conduct evalu cross sect associ outcom relat total pse score comput individu pse factor diet limit set unhealth behavior pa higher score total pse diet factor associ higher fruit intak β g point g point p respect lower consumpt unhealthi snack β g point g point p respect adjust parent bodi mass index educ respond child s sex age associ observ pse pa bodi composit cardiorespiratori fit studi note pse consid conjunct strategi sustain impact childhood obes
2;fine scal inform urban veget social ecolog relationship crucial inform urban plan ecolog research high spatial resolut imageri valuabl tool assess urban area howev urban ecolog remot sens larg focus citi temper zone goal character urban veget cover sub met m resolut aerial imageri identifi social ecolog relationship urban veget pattern tropic citi san juan metropolitan area puerto rico specif object map veget cover use sub met spatial resolut m imageri quantifi residenti non residenti veget investig relationship pattern urban veget vs socioeconom environment factor san juan metropolitan area green combin high spatial resolut imageri object bas classif highli success extract veget cover moist tropic citi accuraci addit simpl spatial pattern analysi allow separ residenti non residenti veget accuraci pattern residenti non residenti veget vari greatli citi socioeconom e g popul densiti build age detach home environment variabl e g topographi import explain variat veget cover spatial regress model howev import socioeconom driver citi temper zone incom home valu import san juan climat cultur differ tropic temper citi result differ social ecolog relationship studi provid novel inform local land use planner highlight valu high spatial resolut remot sens data advanc ecolog research urban plan tropic citi emphas need studi tropic citi
3;cdc recommend number mitig behavior prevent spread sars cov viru caus coronaviru diseas covid behavior includ cover nose mouth mask protect possibl infect public set person live outsid one s household ill household member maintain feet meter distanc person live outsid one s household keep oneself distant person ill wash hand soap water second or soap water avail use hand sanit contain alcohol age posit associ mask use known recommend mitig behavior monitor mitig behavior cours pandem inform target commun behavior modif strategi slow spread covid data foundat covid impact survey collect nation repres data report mitig behavior april jun adult unit state age year report use face mask increas april may reach june howev report mitig behavior e g hand wash social distanc avoid public crowd place declin margin remain unchang time point preval report mitig behavior lowest younger adult age year highest older adult age year lower engag mitig behavior younger adult reason increas incid confirm covid case group shown preced increas year find underscor need priorit clear target messag behavior modif intervent especi young adult encourag uptak support mainten recommend mitig behavior prevent spread covid
5;diabet drug metformin recent shown possess anti canc properti use chemotherapeut drug howev detail mechan metformin improv cancer treatment poorli understood provid evid hepg hepatocellular carcinoma cell metformin sensit cisplatin resist hepg cell hepg ddp increas cellular glycolysi suppress nrf depend transcript metformin increas glucos uptak enhanc glucos metabol glycolyt pathway result elev concentr intracellular nadph lactat consist high glucos medium suppress nrf depend transcript sensit hepg ddp cell cisplatin elev glycolysi requir metformin regul nrf depend transcript cisplatin sensit inhibit glycolysi deoxy d glucos dg significantli mitig benefici effect metformin togeth studi reveal import biolog process gene transcript program underli benefici effect metformin reduc chemo resist hepg cell provid new inform improv chemotherapi liver cancer
7;polyphenol long recogn health promot entiti includ benefici effect cardiovascular diseas reput boost recent follow number encourag clinic studi multipl chronic patholog valid efficaci health benefit polyphenol link well establish power antioxid activ review aim provid comprehens up to d knowledg current therapeut statu polyphenol have suffici heed treatment cardiovascular diseas furthermor data safeti profil highli efficaci polyphenol investig enhanc role cardiac abnorm evid present support action phenol deriv cardiovascular patholog follow receptor signal pathway ultim caus chang endogen antioxid antiplatelet vasodilatori anti inflammatori activ addit vitro antioxid pre clin clinic experi anti inflammatori immunomodulatori attribut polyphenol reveal role cardioprotect agent howev obviou shortag vivo studi relat dose select toxic polyphenol make compound suitabl target clinic investig studi need develop safe potent herbal product cardiovascular diseas novelti review provid comprehens knowledg polyphenol safeti health claim help research identifi moieti like exert protect therapeut effect cardiovascular diseas
8;cell express famili inositol hexakisphosph kinas ip k share enzymat activ individu ip k mediat differ cellular process report ip k enrich lead edg migrat cell associ dynein intermedi chain dic use immunofluoresc microscopi total intern reflect fluoresc microscopi dic ip k recruit interdepend lead edg migrat cell function coordin enhanc turnov focal adhes delet ip k caus defect cell motil neuron dendrit growth eventu lead brain malform result reveal mechan ip k function coordin dic confin intracellular microenviron promot focal adhes turnov
12;ecolog biomechan play central role gener phenotyp divers unrel taxa invad similar ecolog nich biomechan demand drive converg morpholog transform thu examin converg help elucid key catalyst phenotyp chang glide mammal present classic case converg evolut independ evolv numer clade possess patagia wing membran gener lift glide use phylogenet compar method test skelet morpholog clade extant glide mammal demonstr converg result indic glider skeleton converg glider group consist evolv proport longer gracil limb arborealist like increas patagi surfac area nonetheless interpret glider repres incomplet converg evolutionari model fit analys indic strong select pressur glider trait optima marsupi glider group diverg converg glide group remain separ morphospac rather converg singl morphotyp reflect unexpectedli high level morpholog dispar glider skeleton morpholog divers demonstr fossil glider mesozo era possess uniqu skelet characterist absent extant glider glider morpholog strongli influenc factor bodi size attach locat patagia forelimb vari clade thu converg glider appear driven simpl lengthen limb addit skelet trait reflect nuanc glide apparatu distinct differ evolutionari lineag unexpect result add grow evid incomplet converg preval vertebr clade classic case converg highlight import examin form funct relationship light phylogeni biomechan fossil record
13;sinonas mucos melanoma snmm rare tumor compris sinonas malign snmm frequent occur nasal caviti maxillari sinu typic black patch overal snmm harbor poor prognosi year surviv nasal caviti tumor confer better prognosi sinu melanoma primari manag snmm surgeri feasibl follow adjuv radiotherapi recent studi suggest immunotherapi confer surviv benefit patient advanc diseas multidisciplinari team approach shown optim treatment reduc cost minim advers event maxim chanc cure
15;suppli phytolith rich biochar agrosystem increas soil ph cec nutrient avail ad impact si uptak plant growth studi specif impact influenc soil properti assess role phytolith provid plant avail si use young cambisol highli weather poorli buffer desil nitisol biochar produc rice plant respect enrich si deplet si si ident ph nutrient content larg differ si content g si kg si vs g si kg si compar effect wollastonit casio biomass mineralomass wheat plant soil solut plant devic content soil bioavail si biogen si assess origin cacl kinet extract demast na co alkalin dissolut respect demast techniqu dissolv si phytolith wollastonit soil buffer capac cmolc kg cambisol nitisol ident suppli phytolith biochar increas ph cambisol ni increas content bioavail si from mg kg cambisol mg kg nitisol plant si uptak biomass si mineralomass increas largest nitisol demast techniqu did specif quantifi phytolith pool pool main sourc plant avail si cambisol nitisol amend phytolith biochar ident phytolith si suppli howev soil ph soil buffer capac control transfer si soil plant system largest poorli buffer nitisol effect phytolith biochar si bioavail depend soil constitu properti soil type
16;neg interact speci gener diverg select caus charact displac howev process caus similar diverg use spatial tempor replic island popul anoli lizard assess import neg interact drive trait shift previou work show establish anoli sagrei island drove resid anoli carolinensi perch higher evolv larger toepad test interact s causal predict resurvey subset island year later anoli sagrei establish island survey a carolinensi island perch higher larger toepad howev toepad morpholog chang island distinct shift island anoli commun composit chang thu presenc a sagrei partli explain a carolinensi trait variat space time a carolinensi island previous establish a sagrei perch higher decad ago current a carolinensi perch height correl a sagrei densiti result suggest charact displac like interact evolutionari process system tempor data key detect interact
18;scholar interest relationship social context health recent turn attent upstream understand polit social econom institut shape distribut life chanc context compar minor health inequ european countri n investig arrangements welfar state effort immigr incorpor policies influ distribut health health inequ examin measur health seven wave european social survey result seri multilevel mixed effect model minor health inequ vari context persist account socioeconom differ cross level interact result welfar state effort associ better health group unrel level inequ group contrast polici aim protect minor discrimin correl smaller rel health inequ
20;congenit nonunion clavicl well known patholog children posttraumat nonunion rare entiti nonunion open reduct intern fixat clavicl fractur except pediatr popul report patient present posttraumat pseudarthrosi clavicl surgic treatment pseudarthrosi resect defect bridg iliac crest autograft supplement bone morphogenet protein fix elast stabl intramedullari nail procedur offer stabil achiev fractur consolid safe altern plate clavicl nonunion
21;nitric oxid increas lettuc s toler salin restor hormon balanc consequ reduc na accumul activ defens mechan allow attenu ionic oxid osmot stress agricultur crop continu threaten soil salin plant s abil toler soil salin increas treatment signal molecul nitric oxid no involv plant metabol interact phytohormon fulli describ knowledg role radic signal pathway remain fragment work lactuca sativa lettuc plant subject treatment control nutrient solut snp nutrient solut contain μm sodium nitroprussid snp donor nacl nutrient solut contain mm nacl snp nacl nutrient solut contain snp nacl plant expos condit h then root leav collect use evalu biochem paramet reactiv oxygen speci ro product cell membran damag cell death antioxid enzym activ prolin concentr physiolog paramet pigment concentr gas exchang measur phytohormon content evalu growth toler index nutrient concentr plant expos treatment day l sativa exposur nacl trigger ionic osmot oxid stress result hormon imbal cell death decreas growth deleteri chang correl na content veget tissu ad decreas na accumul stabil miner nutrient concentr maintain photosynthet rate re establish growth no sign action re establish phytohormon balanc result antioxid activ osmot regul consequ increas plant toler salt
23;axillari lymph node statu import prognost factor breast cancer studi explor predict factor sentinel lymph node sln metastasi preoper clinicopatholog featur includ impair glucos toler igt studi compris patient diagnos breast cancer underw surgeri nagasaki harbor medic center april decemb factor assess use univari multivari analys clinicopatholog data cancer includ patient age gender menstrual statu breast ovarian cancer famili histori bodi mass index glycosyl hemoglobin clinic tumor size nipple tumor distanc ntd tumor histolog histolog grade node statu estrogen receptor progesteron receptor human epiderm growth factor receptor type statu ki label index cohort case ratio sln metastasi univari analysi tumor size ntd igt clinic tumor stage associ sln metastasi multivari analysi tumor size ntd igt associ sln metastasi receiv oper characterist curv show sensit specif respect cut off cm tumor size area curv auc confid interv sensit specif respect cut off cm ntd auc confid interv predict risk sln metastasi t t breast cancer patient larger tumor size tumor locat closer nippl igt higher risk sln metastas other
24;non smal cell lung cancer nsclc largest type lung cancer lc higher mortal rate circular rna circrna shown play import role cancer progress therefor studi explor function hsa circ nsclc express level hsa circ microrna p mir p forkhead box p foxp determin quantit real tim polymeras chain reaction qrt pcr ribonucleas r rnase r actinomycin d actd use verifi authent stabil hsa circ cell count kit cck flow cytometri transwel assay use evalu abil prolifer apoptosi migrat invas nsclc cell also western blot wb analysi perform assess level apoptosi epithelial mesenchym transit emt proliferation rel protein foxp protein rna immunoprecipit rip dual luciferas report assay use verifi interact mir p hsa circ foxp besid mice xenograft model construct confirm effect hsa circ nsclc tumor growth vivo hsa circ lowli express nsclc tissu cell overexpress inhibit prolifer migrat invas emt process improv apoptosi nsclc cell mir p spong hsa circ overexpress invert suppress effect overexpressed hsa circ nsclc progress moreov foxp target mir p silenc revers inhibit effect overexpressed hsa circ nsclc progress addit hsa circ overexpress reduc tumor growth nsclc vivo hsa circ spong mir p improv foxp express inhibit nsclc progress studi show hsa circ potenti biomark earli diagnosi nsclc
25;childhood maltreat cm compris experi abus neglect childhood cm caus psycholog biolog alter affect individu human hardli explor cm consequ transmit directli biolog level gener here investig associ matern cm mitochondri bioenerget mitochondri respir intracellular mitochondri densiti immun cell mother compar newborn n healthi mother newborn dyad matern peripher blood mononuclear cell neonat umbil cord blood mononuclear cell collect cryopreserv shortli parturit measur mitochondri respir intracellular mitochondri densiti high resolut respirometri spectrophotometr analys respect matern cm assess childhood trauma questionnair matern neonat mitochondri bioenerget quantit compar posit correl femal newborn show higher mitochondri respir compar male newborn matern cm load significantli posit associ mitochondri respir densiti mother mitochondri respir newborn matern neonat mitochondri bioenerget posit correl matern cm small effect mitochondri densiti newborn signific studi adjust multipl comparison biolog relev find consequ child develop need investig futur larger studi studi report data mitochondri bioenerget healthi mother newborn dyad vari degre cm
30;plant regularli encount patchili distribut soil nutrient common forag respons prolifer root high qual patch influenc social environ behaviour given limit attent despit import fit consequ competit soil resourc plant use common sunflow helianthu annuu l compar local root prolifer high qual patch plant grown plant differ social environ neighbour plant share equal access high qual patch neighbour plant present farther high qual patch focal individu closer proxim high qual patch sunflow grown prolifer root high nutri patch lower nutri soil plant decreas root prolifer high nutri patch equidist neighbour convers plant increas root prolifer closer proxim patch rel nearbi neighbour conting respons allow sunflow avoid competit highli contest patch pre empt soil resourc neighbour better access high qual patch compar patch occup sunflow grown equidist high qual patch occup sunflow grown high qual patch neighbour plant grown neighbour decreas root length share patch did increas root length high qual patch closer proxim to resourc pre empt import individu resourc abund result nutrient forag respons plant social conting plant account possibl pre empt limit resourc forag decis
31;studi examin investor firm respons california transpar suppli chain act ctsca ctsca requir larg retail manufactur firm disclos effort erad slaveri human traffick suppli chain rare exampl mandat corpor social respons disclosur base sampl retail compani subject ctsca signific neg market reaction pass ctsca furthermor reaction significantli neg larger firm compani face greater suppli chain risk apparel footwear retail suggest investor place neg valu exposur legitimaci threat social domain respect compani disclosur respons document rel high complianc legisl disclosur respons appear symbol substant natur final analysi indic disclosur choic disclosur extens significantli higher high suppli chain risk compani suggest respons influenc concern strateg legitim overal limit qualiti disclosur suggest that addit rule guidanc mandat lead meaning social disclosur
32;healthcar system unit state increasingli turn use dispos medic equip attempt save time lower cost reduc transmiss infect howev use dispos instrument associ increas solid wast product neg impact environ increas greenhous ga emiss purpos studi inform discuss appli life cycl assess method evalu carbon footprint vagin specula single us acryl model reusabl stainless steel model function unit studi defin complet gynecolog examin type speculum greenhous ga emiss eg carbon dioxid methan nitrou oxid life cycl stage includ materi product manufactur transport use reprocess end of lif analyz use simapro life cycl assess softwar convert carbon dioxid equival reusabl stainless steel grade speculum lesser carbon footprint multipl model scenario differ reprocess techniqu autoclav loading effici number use reusabl stainless steel grade dispos acryl specula materi product manufactur phase contribut heavili total life cycl carbon footprint acryl speculum use reprocess phase contribut carbon footprint stainless steel specula use dispos vagin specula associ increas greenhous ga equival compar reusabl altern signific differ clinic util find use inform decision mak healthcar system weigh wide rang consider make final purchas decis similar analyt method appli compon health system wast stream
33;methotrex mtx effect immunosuppress anti canc agent associ effect includ nephrotox capsaicin compon hot chilli pepper induc rapid desensit trpv pain receptor use pain treatment capsaicin anti canc activ includ anti inflammatori properti thu capsaicin potenti prevent mtx induc nephrotox purpos research work observ protect effect capsaicin renal toxic caus methotrex mechan respons effect expect capsaicin nephroprotect effect mtx intox rat serum creatinin urea nitric oxid no renal malondialdehyd mda level decreas significantli concurr increas superoxid dismutas sod renal glutathion peroxidas gpx activ compar rat untreat nephrotox biochem analys confirm protect effect capsaicin conclud capsaicin provid protect mtx nephrotox rat anti inflammatori antioxid activ
34;atherosclerosi major cardiovascular diseas caus ischemia heart brain extrem lead infarct hypolipidem agent atorvastatin calcium ato allevi atherosclerosi reduc plasma lipid inflammatori factor howev low bioavail ato limit widespread use clinic effect curcumin cur natur polyphenol antioxid anti inflamm bioactiv potenti anti atherosclerosi activ reduc ato induc cytotox liposom modifi use target ligand e selectin bind peptid prepar co deliv ato cur dysfunct endotheli cell ec overexpress e selectin molecul involv inhibit adhes e selectin intercellular cell adhes molecule icam inflamm il monocyt chemotact protein mcp human aortic endotheli cell evalu use real tim quantit pcr flow cytometri immunofluoresc stain antiatherosclerosi effect liposom co load ato cur vivo evalu use apo knockout apoe mice target liposom deliv ato cur dysfunct ec result synergist suppress adhes molecul e selectin icam plasma lipid level moreov treatment reduc foam cell format secret inflammatori factor il mcp block monocyt migrat intima addit cur success reduc ato induc cytotox vitro vivo experi demonstr cell target co deliveri ato cur dysfunct ec drastic reduc atherosclerot lesion fewer effect ato cur alon
37;postexposur prophylaxi pep hepat hepa vaccin immun globulin ig effect prevent infect hepat viru hav administ week exposur preexposur prophylaxi hav infect administr hepa vaccin ig provid protect unvaccin person travel work countri high intermedi hav endem advisori committe immun practic acip hepat vaccin work group conduct systemat review evid administ vaccin pep person age year review hepa vaccin efficaci safeti infant benefit protect hav intern travel februari acip recommend updat supersed previou acip recommend hepa vaccin pep intern travel current recommend includ hepa vaccin administ person age month pep addit hepa vaccin ig administ person age year depend provid s risk assess acip recommend hepa vaccin administ infant age month travel outsid unit state protect hav recommend travel rel dose infant age month count routin dose seri dosag ig updat applic ml kg hepa vaccin pep provid advantag ig includ induct activ immun longer durat protect eas administr greater accept avail
43;caus dispar biodivers region fundament question biogeographi ecolog evolutionari biolog evolutionari biogeograph process speciat extinct dispers directli determin speci rich pattern studi use integr phylogenet approach howev strikingli high rich east asia rel northern hemispher region remain poorli understood perspect here time test gener hypothes older colon time faster diversif rate explain pattern use plant tribe lysimachiea primulacea model system gener new time calibr phylogeni lysimachiea gene speci estim colon time diversif rate region test rel import factor explain region rich pattern time diversif rate explain rich pattern region lysimachiea instead new index combin factor explain global rich pattern group high east asian biodivers base result lysimachiea suggest high rich plant east asia explain combin older colon time faster diversif rate region
45;increas global atmospher nitrogen n deposit consider impact soil respir differ carbon dioxid co resourc differ compon soil respir differ mechan soil respond n addit aim studi investig effect n addit total soil respir rst rhizospher respir rsr heterotroph respir rsh elucid potenti causal mechan artifici n addit experi conduct evergreen broad leav forest western edg sichuan basin china effect n treatment level kg n ha yr measur n applic initi april trench method use partit rst rst rsr valu rst compon measur monthli april mean annual rst μmol co m s rsh rsr contribut rst respect nitrogen addit significantli reduc rst compon contribut rsr rst microbi biomass carbon c ph bulk soil decreas significantli n applic nitrogen addit effect rhizospher soil biochem properti rsr significantli posit correl root biomass castanopsi platyacantha rsh significantli posit correl concentr microbi biomass c mbc microbi biomass n mbn bulk soil posit correl rsr root biomass indic n applic reduc rsr reduc belowground c alloc c input rhizospher valu rsh decreas primarili reduct microbi activ soil organ matter decomposit root fre soil n ad presenc plant root mitig effect n input rhizospher alter root morpholog exud
