156847;Precarious employment and mental health: a systematic review and meta-analysis of longitudinal studies
250827;Associations of Parental Self-Efficacy With Diet, Physical Activity, Body Composition, and Cardiorespiratory Fitness in Swedish Preschoolers: Results From the MINISTOP Trial
27836;Vegetation cover in relation to socioeconomic factors in a tropical city assessed from sub-meter resolution imagery
764680;COVID-19 Mitigation Behaviors by Age Group - United States, April-June 2020
825869;Metformin suppresses Nrf2-mediated chemoresistance in hepatocellular carcinoma cells by increasing glycolysis
91326;Therapeutic Effects and Safe Uses of Plant-Derived Polyphenolic Compounds in Cardiovascular Diseases: A Review
188039;Inositol hexakisphosphate kinase 3 promotes focal adhesion turnover via interactions with dynein intermediate chain 2
735458;Incomplete convergence of gliding mammal skeletons
643952;Contemporary Multidisciplinary Management of Sinonasal Mucosal Melanoma
318057;Effects of phytolithic rice-straw biochar, soil buffering capacity and pH on silicon bioavailability
951926;Character displacement in the midst of background evolution in island populations of Anolis lizards: A spatiotemporal perspective
432627;Institutions, Incorporation, and Inequality: The Case of Minority Health Inequalities in Europe
582699;Fracture Nonunion of the Clavicle After Surgical Reduction in a 13-Year-Old Girl: A Case Report
255770;Hsa_circ_0043265 Suppresses Proliferation, Metastasis, EMT and Promotes Apoptosis in Non-Small Cell Lung Cancer Through miR-25-3p/FOXP2 Pathway
427098;Synergistic effects of liposomes encapsulating atorvastatin calcium and curcumin and targeting dysfunctional endothelial cells in reducing atherosclerosis
125161;What explains high plant richness in East Asia? Time and diversification in the tribe Lysimachieae (Primulaceae)
649228;Population-Based Analysis Of The Use Of Radium-223 For Bone-Metastatic Castration-Resistant Prostate Cancer In Ontario, And Of Factors Associated With Treatment Completion And Outcome
95452;Color-matching between pollen and corolla: hiding pollen via visual crypsis?
628705;Ten simple rules on how to develop a stakeholder engagement plan
590079;Vitiligo-Like Lesions in a Patient with Metastatic Breast Cancer Treated with Cyclin-Dependent Kinase (CDK) 4/6 Inhibitor: A Case Report and Literature Review
315842;Melbourne: The Archaeology of a World City
963594;Probabilistic Opinion Pooling with Imprecise Probabilities
189296;Polygenic evolution drives species divergence and climate adaptation in corals : POLYGENIC CLIMATE ADAPTATION IN CORALS
194887;Concurrent chemoradiation therapy tailored to the older adults with esophageal cancer: state of the art and the future
845162;Palm community transects and soil properties in western Amazonia
201913;Identification of the shared gene signatures and pathways between polycystic ovary syndrome and endometrial cancer: An omics data based combined approach
652396;Quercetin may repair the impaired oxidant-antioxidant balance in 1, 2, 3, 4-tetrachlorodibenzo-p-dioxin induced cardiac injury in male rats
637890;Mechanophenotyping of 3D multicellular clusters using displacement arrays of rendered tractions
458554;Hydrographic and Biological Impacts of a Glacial Lake Outburst Flood (GLOF) in a Patagonian Fjord
107570;Testing predictions of inclusive fitness theory in inbreeding relatives with biparental care
560740;Frustrated Caring: Family Members' Experience of Motivating COPD Patients Towards Self-Management
51492;BACILLARY LAYER DETACHMENT: MULTIMODAL IMAGING AND HISTOLOGIC EVIDENCE OF A NOVEL OPTICAL COHERENCE TOMOGRAPHY TERMINOLOGY: Literature Review and Proposed Theory : Literature Review and Proposed Theory
678833;Examining the utility of cystatin C as a confirmatory test of chronic kidney disease across the age range in middle-aged and older community-dwelling adults
668055;Human N-acetylglucosaminyltransferase II substrate recognition uses a modular architecture that includes a convergent exosite
270654;MicroRNA 362-3p Reduces hERG-related Current and Inhibits Breast Cancer Cells Proliferation
791355;How to rank rankings? Group performance in multiple-prize contests
998146;Oncolytic Vaccinia Virus-Mediated Antitumor Effect and Cell Proliferation Were Promoted in PTC by Regulating circRNA_103598/miR-23a-3p/IL-6 Axis
3142;Long noncoding RNA ILF3-AS1 regulates myocardial infarction via the miR-212-3p/SIRT1 axis and PI3K/Akt signaling pathway
663083;Development of an Instrument to Measure Academic Resilience Among Pharmacy Students
897841;DNA methylation rather than single nucleotide polymorphisms regulates the production of an aberrant splice variant of IL6R in mastitic cows
611734;Unified energetics analysis unravels SpCas9 cleavage activity for optimal gRNA design
32639;Discovery of potent thrombin inhibitors from a protease-focused DNA-encoded chemical library
396791;Attenuated serum 25-hydroxyvitamin D and vitamin D binding protein associated with cognitive impairment in patients with type 2 diabetes
764644;Prevalence of Generalised Anxiety Disorders Among Clinical Training Students at the University of Sharjah
145601;Anxiety, Stress, and Trauma Symptoms in African Americans: Negative Affectivity Does Not Explain the Relationship between Microaggressions and Psychopathology
439141;Exploring the Underlying Mechanism of Shenyankangfu Tablet in the Treatment of Glomerulonephritis Through Network Pharmacology, Machine Learning, Molecular Docking, and Experimental Validation
841704;Female genital mutilation and migration in Mali: do return migrants transfer social norms?
30159;Dynamics of Early Serum Tumour Markers and Neutrophil-to-Lymphocyte Ratio Predict Response to PD-1/PD-L1 Inhibitors in Advanced Non-Small-Cell Lung Cancer
150945;Unmasking Corporate Sustainability at the Project Level: Exploring the Influence of Institutional Logics and Individual Agency
428885;Potential Yield Loss in Dry Bean Crops Due to Weeds in the United States and Canada
170571;Excitation-multiplexed multicolor superresolution imaging with fm-STORM and fm-DNA-PAINT
605352;SARS-CoV-2 was already circulating in Italy, in early December 2019
228309;Engineered Nanomaterials: The Challenges and Opportunities for Nanomedicines
48167;Testing for local adaptation in adult male and female fitness among populations evolved under different mate competition regimes
376827;MSH1 is required for maintenance of the low mutation rates in plant mitochondrial and plastid genomes
772723;Settlement and housing experiences of recent immigrants in small- and mid-sized cities in the interior of British Columbia (Canada)
919617;Early Holocene wetland succession at Lake Flixton (UK) and its implications for Mesolithic settlement
703883;Exploring modular allostery via interchangeable regulatory domains
84268;Propofol induces mitochondrial-associated protein LRPPRC and protects mitochondria against hypoxia in cardiac cells
227142;Modeling between-population variation in COVID-19 dynamics in Hubei, Lombardy, and New York City
54849;Inhibition of the renin-angiotensin system causes concentric hypertrophy of renal arterioles in mice and humans
967946;Assessing functional status after intensive care unit stay: the Barthel Index and the Katz Index
94340;Consistency in End-of-Life Care Preferences Between Hospitalized Elderly Patients and Their Primary Family Caregivers
52587;Diagnostic Value of a Novel Eosinophil Cationic Protein-Myeloperoxidase Test Paper Before and After Treatment for Allergic Rhinitis
365506;Acalabrutinib with or without obinutuzumab versus chlorambucil and obinutuzmab for treatment-naive chronic lymphocytic leukaemia (ELEVATE TN): a randomised, controlled, phase 3 trial
772842;Psychometric Properties and Factor Analysis of Family Accommodation Scale For Obsessive Compulsive Disorder-Interviewer-Rated-Thai Version (FAS-T)
67181;One Size Does Not Fit All: Alternative Values-Based ‘Recipes’ for Life Satisfaction
686960;Regulation of alternative macrophage activation by MSCs derived hypoxic conditioned medium, via the TGF-β1/Smad3 pathway
453735;COVID-19 pandemic-related lockdown: response time is more important than its strictness
186409;Cleft lip and palate in context: Learning from, and adding to, the sociological literature on long-term conditions
621576;15N detection harnesses the slow relaxation property of nitrogen: Delivering enhanced resolution for intrinsically disordered proteins
924629;Control as a Core Component of User Involvement in Reablement: A Qualitative Study
56951;Interspecific competition for frugivores: population-level seed dispersal in contrasting fruiting communities
472570;Surface velocity of the Northeast Greenland Ice Stream (NEGIS): assessment of interior velocities derived from satellite data by GPS
973945;Assessing strategies to mitigate phosphorus leaching from drained clay soils
212260;Different responses of predator and prey functional diversity to fragmentation
263843;Costs of breeding are rapidly buffered and do not affect migratory behavior in a long-lived bird species
513096;Coinfection of SARS-CoV-2 and Other Respiratory Pathogens
723419;A Call to Action for a Programmatic Approach to Addressing Health Disparities and Cultural Competency in Pharmacy Education
658525;Expression of miR-206 in Human Knee Articular Chondrocytes and Effects of miR-206 on Proliferation and Apoptosis of Articular Chondrocytes
993945;Open science, reproducibility, and transparency in ecology
913478;Trauma-Related Cognitions and Cognitive Emotion Regulation as Mediators of PTSD Change Among Treatment-Seeking Active-Duty Military Personnel With PTSD
947748;A Novel Composite Metric for Predicting Patient Satisfaction With Spinal Cord Stimulation
27068;Information-Seeking Strategies of People with Multiple Sclerosis in Spain: The INFOSEEK-MS Study
594769;Relationship Between the Triglyceride Glucose Index and the Risk of First Stroke in Elderly Hypertensive Patients
592923;ATP13A2-mediated endo-lysosomal polyamine export counters mitochondrial oxidative stress
461370;The Effect of Hallux Valgus Surgery on Quality of Life
65702;Promoting mechanism of serum amyloid a family expression in mouse intestinal epithelial cells
919803;Homeologue-specific expression divergence in the recently formed tetraploid Capsella bursa-pastoris (Brassicaceae)
818740;Prison environment and non-communicable chronic disease modifiable risk factors: length of incarceration trend analysis in Mexico City
763966;Dual self-regulated delivery of insulin and glucagon by a hybrid patch
370840;Early-life injury produces lifelong neural hyperexcitability, cognitive deficit and altered defensive behaviour in the squid Euprymna scolopes
415028;Curcumin Protects Against Radiotherapy-Induced Oxidative Injury to the Skin
705334;Root growth plasticity to drought in seedlings of perennial grasses
387316;CONSORT 2010 statement: extension to randomised crossover trials
800885;A review of time scale fundamentals in the g-formula and insidious selection bias
685396;Genome-Wide Expression Profiling by RNA-Sequencing in Spinal Cord Dorsal Horn of a Rat Chronic Postsurgical Pain Model to Explore Potential Mechanisms Involved in Chronic Pain
463529;Influenza Hemagglutination-inhibition Antibody Titer as a Mediator of Vaccine-induced Protection for Influenza B
255634;Implementing post-occupancy evaluation in social housing complemented with BIM: A case study in Chile
468118;Regulation of ERK basal and pulsatile activity control proliferation and exit from the stem cell compartment in mammalian epidermis
