213068;cultur revolut reduc complex song humpback whale
539517;variant cdhr cacnac lta gene predispos sensit respons warfarin patient cardiovascular diseas
804465;studi tissu macrophag vitro ipsc deriv cell answer
850449;evalu modifi atria risk score predict mortal hospit patient covid
29989;impact coronaviru diseas pandem emerg depart servic experi largest tertiari center taiwan
303028;motil curv bacteria pareto optim
651585;recommend advisori committe immun practic use hepat b vaccin novel adjuv
363197;enhanc oral bioavail ibandron gastroretent raft form drug deliveri system vitro vivo evalu
103998;commun effici success test macarthur s minim principl phytoplankton commun
446443;autofluoresc bronchoscopi video analysi lesion frame detect
427689;artifici select shed light development mechan limb elong development mechan limb elong
144028;popul project model alien plant speci presenc absenc aboveground competit
78308;ultrafin particl emiss modern gasolin diesel vehicl electron microscop perspect
702931;disclosur respons corrupt scandal case siemen ag
858281;proven karakum desert sand turkmenistan lithic rich orogen signatur central asian dune field
730661;all us research program
552985;drive crazi difficult social tie subject well b
748269;detect quantif black foot crown root rot pathogen grapevin nurseri soil western cape south africa
916429;age lung idiopath pulmonari fibrosi
789876;psvii effect feed direct f microbi perform carcass trait finish bo indicu cattl
804645;surfac curvatur guid earli construct activ mound build termit
842940;effect vision health educ free eyeglass knowledg vision usag spectacl primari school student evid gansu shaanxi provinc china
712958;relationship sunlight rang use commerci free rang hen australia
168427;cinamr clinic inform network antimicrobi resist project pilot microbi surveil use hospit link region laboratori kenya studi protocol
202809;nlcip non smal cell lung cancer immunotherapi prognosi score
440902;commun risk percept complianc prevent measur covid pandem ethiopia
975172;sever cervic kyphosi spondyloptosi myelopathi larsen syndrom report case
661784;brain activ associ anticip deliveri monetari reward systemat review meta analysi fmri studi
646367;rapid diagnost test mening encephalitis biofir
192837;instrument patient educ psychometr evalu expect knowledg ekhp receiv knowledg hospit patient rkhp
335691;improv age measur low middle incom countri comput vision test seneg
587690;antibody medi crosslink gut bacteria hinder spread antibiot resist
496509;contemporari loss migrat monarch butterfli
284930;investig persist suicid unit state evid quantil unit root test
402317;overview electron tongu sens environment aqueou matric potenti monitor emerg organ contamin
287650;novel anti obes mechan liraglutid improv adipos tissu leptin resist high fat diet f obes mice
561961;volatil biomark symptomat asymptomat malaria infect human
8196;welfare fund sex doula programm
35345;repeat group differ collect behaviour stickleback shoal ecolog context
38507;elicitor defens gene induct plant alter lignin composit
128712;loss supervillin caus myopathi myofibrillar disorgan autophag vacuol
310413;strain induc acceler asymmetr spatial degrad polymer vascular scaffold
366267;partner switch metabol flux model cnidarian dinoflagel symbiosi
946689;determin neurotransmitt rat brain studi hypnot effect ziziphi spinosa semen aqueou extract insomnia rat model uplc ms m
127374;shorter sleep predict longer subsequ day sedentari durat healthi midlif adult sleep apnea
774615;target exosom new biomark therapeut approach alzheim s diseas
579106;morphogenesi termit mound
