627848;precari employ mental health systemat review meta analysi longitudin studi
871232;associ parent self efficaci diet physic activ bodi composit cardiorespiratori fit swedish preschool result ministop trial
511964;veget cover relat socioeconom factor tropic citi assess sub met resolut imageri
575285;covid mitig behavior age group unit state april jun
707312;metformin suppress nrf mediat chemoresist hepatocellular carcinoma cell increas glycolysi
44142;therapeut effect safe use plant deriv polyphenol compound cardiovascular diseas review
813606;inositol hexakisphosph kinas promot focal adhes turnov interact dynein intermedi chain
656057;incomplet converg glide mammal skeleton
883989;contemporari multidisciplinari manag sinonas mucos melanoma
833384;effect phytolith rice straw biochar soil buffer capac ph silicon bioavail
471431;charact displac midst background evolut island popul anoli lizard spatiotempor perspect
473111;institut incorpor inequ case minor health inequ europ
672461;fractur nonunion clavicl surgic reduct year old girl case report
918029;nitric oxid phytohormon interact respons lactuca sativa salin stress
103949;predict factor clinicopatholog characterist sentinel lymph node metastasi t t breast cancer
604970;hsa circ suppress prolifer metastasi emt promot apoptosi non smal cell lung cancer mir p foxp pathway
769168;childhood maltreat associ chang mitochondri bioenerget matern neonat immun cell
99887;effect neighbour locat nutrient distribut root forag behaviour common sunflow
174079;mandat social disclosur analysi respons california transpar suppli chain act
300279;compar carbon footprint analysi dispos reusabl vagin specula
43073;capsaicin amelior nephrotox induc methotrex
511235;synergist effect liposom encapsul atorvastatin calcium curcumin target dysfunct endotheli cell reduc atherosclerosi
274222;updat recommend advisori committe immun practic use hepat vaccin postexposur prophylaxi preexposur prophylaxi intern travel
51545;explain high plant rich east asia time diversif tribe lysimachiea primulacea
275950;nitrogen addit reduc rhizospher heterotroph respir subtrop evergreen broad leav forest
628585;evalu effect surveil contain measur patient covid singapor januari februari
684201;make tumour cell type specif dissect ustilago maydis induc tumour develop maiz leav
413699;population bas analysi use radium bone metastat castration resist prostat cancer ontario factor associ treatment complet outcom
440186;color match pollen corolla hide pollen visual crypsi
586044;ponatinib novel multi tyrosin kinas inhibitor human malign
834247;simpl rule develop stakehold engag plan
634240;domest tether gender differ career path domest respons top research medic school graduat
571918;vitiligo lik lesion patient metastat breast cancer treat cyclin depend kinas cdk inhibitor case report literatur review
804907;thermodynam relativist quantum field confin caviti
679602;social prescrib nation health servic primari care ethic consider
94596;melbourn archaeolog world citi
280189;commun human care effect burnout nurs
456762;explor live experi long covid black minor ethnic group uk protocol qualit interview art bas method
725517;laminin collagen iv inclus immunoisol microcapsul reduc cytokine medi cell death human pancreat islet
822528;probabilist opinion pool imprecis probabl
385932;commun resourc mass explor wheat grain proteom applic late matur alpha amylas lma problem
504783;log soil nutrient independ explain plant trait express tropic forest
294113;prognost indic outcom hospitalis covid patient neurolog diseas individu patient data meta analysi
425975;twenty f year research institut entrepreneurship econom growth learn
148414;polygen evolut drive speci diverg climat adapt coral polygen climat adapt coral
939282;concurr chemoradi therapi tailor older adult esophag cancer state art futur
335260;palm commun transect soil properti western amazonia
102719;identif share gene signatur pathway polycyst ovari syndrom endometri cancer omic data base combin approach
905693;quercetin repair impair oxidant antioxid balanc tetrachlorodibenzo p dioxin induc cardiac injuri male rat
856608;mechanophenotyp d multicellular cluster use displac array render traction
138057;hydrograph biolog impact glacial lake outburst flood glof patagonian fjord
991339;test predict inclus fit theori inbreed rel biparent care
543832;frustrat care famili member experi motiv copd patient self manag
322849;bacillari layer detach multimod imag histolog evid novel optic coher tomographi terminolog literatur review propos theori literatur review propos theori
451804;examin util cystatin c confirmatori test chronic kidney diseas age rang middle ag older community dwel adult
530385;human n acetylglucosaminyltransferas ii substrat recognit use modular architectur includ converg exosit
927821;preval campylobact spp polish poultri meat
354714;emot reason human decision mak
709399;microrna p reduc herg rel current inhibit breast cancer cell prolifer
98312;reconstruct tibial plateau fractur malunion set larg cartilag defect adolesc case report
48677;percept use sit to stand desk middl school classroom
206429;rank rank group perform multiple pr contest
109266;evalu optic nerv diamet possibl biomark disabl patient multipl sclerosi
507225;oncolyt vaccinia virus medi antitumor effect cell prolifer promot ptc regul circrna mir a p il axi
589416;identif biomark autophagy rel gene earli advanc carotid atherosclerosi
282106;relationship red cell index sever chronic obstruct pulmonari diseas
512759;cost distrust virtuou cycl tax complianc jordan
829217;long noncod rna ilf as regul myocardi infarct mir p sirt axi pi k akt signal pathway
344765;weapon hidden underneath bio control agent potenti activ plant induc system resist control crop fusarium diseas
182196;covid associ mucormycosi evidence bas critic review emerg infect burden pandem s second wave india
461317;develop instrument measur academ resili pharmaci student
287631;supervisor subordin guanxi job satisfact migrant worker china
14749;caus mortal rate risk factor death community dwel european age year over result survey health age retir europ
142484;dna methyl singl nucleotid polymorph regul product aberr splice variant il r mastit cow
926585;unifi energet analysi unravel spcas cleavag activ optim grna design
126159;ctrp attenu express ln cav induc high glucos camkkβ ampk pathway rlsec
958446;daytim depress temperature normalis stem co efflux young poplar tree domin low turgor pressur intern transport respir co
482291;discoveri potent thrombin inhibitor protease focus dna encod chemic librari
841650;covari fetal skull matern pelvi perinat period rhesu macaqu evolut childbirth primat
150414;attenu serum hydroxyvitamin d vitamin d bind protein associ cognit impair patient type diabet
797315;increas branch sialyl n link glycan correl improv pharmacokinet profil bay compar full length rfviii product
730725;preval generalis anxieti disord clinic train student univers sharjah
845662;awar energi consumpt pro environment choic chines household
427362;anxieti stress trauma symptom african american neg affect doe explain relationship microaggress psychopatholog
724218;peer bas strategi overcom hpv vaccin inequ rural commun physic distancing compli approach
782093;repair chariti trust time accident crisi role crisi histori crisi respons strategi
553877;explor underli mechan shenyankangfu tablet treatment glomerulonephr network pharmacolog machin learn molecular dock experiment valid
467013;femal genit mutil migrat mali return migrant transfer social norm
136235;dynam earli serum tumour marker neutrophil to lymphocyt ratio predict respons pd pd l inhibitor advanc non small cel lung cancer
889621;unmask corpor sustain project level explor influenc institut logic individu agenc
823231;potenti yield loss dri bean crop weed unit state canada
931444;excitation multiplex multicolor superresolut imag fm storm fm dna paint
925350;sars cov circul itali earli decemb
634252;engin nanomateri challeng opportun nanomedicin
58896;lfa activ enrich tumor specif t cell cold tumor model synerg ctla blockad
332084;adult advanc life support intern consensu cardiopulmonari resuscit emerg cardiovascular care scienc treatment recommend
401861;test local adapt adult male femal fit popul evolv differ mate competit regim
13874;transpos temper phage promot evolut diverg social strategi pseudomona aeruginosa popul
880466;msh requir mainten low mutat rate plant mitochondri plastid genom
411974;autophag adapt oxid stress alter periton residenti macrophag surviv ovarian cancer metastasi
955054;prepar character vitro in vivo evalu lovastatin load plga microspher local administr femor head necrosi
567640;select structur allel variat bias plastic estim
378594;sexual harass sexual assault preval correl sexual trauma french militari
808326;peopl bitten dog cross sect survey preval incid factor associ dog bite uk commun
497716;associ neutrophil percentage to albumin ratio outcom cardiac intens care unit patient
677814;settlement hous experi recent immigr small mid siz citi interior british columbia canada
373408;hourli movement decis indic larg carnivor inhabit develop landscap
639164;bi dimension null model analysi presence abs binari matric
19800;synthesi character pharmacodynam studi enrofloxacin mesyl
146433;earli holocen wetland success lake flixton uk implic mesolith settlement
975350;ethic dimens zoonot diseas research perspect tradit livestock keeper zambia
741681;explor modular allosteri interchang regulatori domain
57691;propofol induc mitochondrial associ protein lrpprc protect mitochondria hypoxia cardiac cell
713967;cosmolog evolut semiloc string network
493392;model between popul variat covid dynam hubei lombardi new york citi
658572;woodi plant encroach amplifi spatial heterogen soil phosphoru consider depth
144192;suppress costimul human cytomegaloviru promot evas cellular immun defens
817526;manag citizenship behavior environ development perspect
555204;inhibit renin angiotensin caus concentr hypertrophi renal arteriol mice human
403190;gene cluster conserv provid insight cercosporin biosynthesi extend product genu colletotrichum
276191;asymmetr interfer competit nich partit nativ invas anoli lizard
382144;limit phenolog dietari overlap bee commun spring flower crop herbac enhanc
157080;inhibit cancer cell migrat cu msio peg nanoparticl repress mmp mmp express
15491;integr diseas manag chronic obstruct pulmonari diseas primari care control trial clinic program cohort studi
393540;simpl unbias osa prescreen introduct new morpholog osa predict score
267530;assess function statu intens care unit stay barthel index katz index
402939;consist end of lif care prefer hospit elderli patient primari famili caregiv
522654;field therapi solid organ transplant recipi initi earli enough
319692;evalu interrel symptom
24521;dynam effect isosteviol insulin secret inabl counteract impair β cell function gluco lipo aminoacidotox studi vitro
921179;diagnost valu novel eosinophil cation protein myeloperoxidas test paper treatment allerg rhiniti
441417;zinc chelat n n n n tetraki pyridylmethyl ethylenediamin reduc resist mycobacterium abscessu imipenem
361033;gut microbiota chang relationship inflamm patient acut chronic insomnia
296200;mode debond larg deform condit includ note cleavage peel transit
432545;individual species specif skin microbiom differ estrildid finch speci reveal amplicon sequenc
447201;chd regul cardiovascular develop atp depend independ activ
283529;acalabrutinib obinutuzumab versu chlorambucil obinutuzmab treatment na chronic lymphocyt leukaemia elev tn randomis control phase trial
799302;psychometr properti factor analysi famili accommod scale obsess compuls disorder interviewer rated thai version fas t
10268;size doe fit all altern values bas recip life satisfact
349555;regul altern macrophag activ msc deriv hypox condit medium tgf β smad pathway
158877;proteom analysi primari colon cancer synchron solitari liver metastasi
225613;regul fibroblast apoptosi prolifer microrna b system sclerosi
68551;trust stranger close acquaint member ingroup differ trust base social class spain
698459;clinic evalu ausdiagnost sars cov multiplex tandem pcr assay
889020;optic ray transfer matrix model turbul cell cascad
516785;abundance bas detect spatially explicit metapopul case studi vulner beetl speci hollow tree
854008;microbi commun structur function decoupl phosphoru gradient stream
687719;covid pandemic rel lockdown respons time import strict
161754;cleft lip palat context learn from ad to sociolog literatur long term condit
610885;n detect har slow relax properti nitrogen deliv enhanc resolut intrins disord protein
359178;control core compon user involv reablement qualit studi
912753;interspecif competit frugivor population level seed dispers contrast fruit commun
770027;surfac veloc northeast greenland ice stream negi assess interior veloc deriv satellit data gp
902849;assess strategi mitig phosphoru leach drain clay soil
10169;differ respons predat prey function divers fragment
361012;cost breed rapidli buffer affect migratori behavior long liv bird speci
320380;coinfect sars cov respiratori pathogen
715718;scientist s guid develop explanatori statist model use causal analysi principl
881733;test eco evolutionari predict use fossil data phylet evolut follow ecolog opportun
558505;action programmat approach address health dispar cultur compet pharmaci educ
790810;current advanc nanocarri technology bas activ cosmet ingredi beauti applic
862447;estim school race ethn enrol effect student mental health densiti divers risk protect factor
950096;land atmospher feedback exacerb concurr soil drought atmospher arid
927591;express mir human knee articular chondrocyt effect mir prolifer apoptosi articular chondrocyt
933964;open scienc reproduc transpar ecolog
770666;trauma rel cognit cognit emot regul mediat ptsd chang treatment seek active duti militari personnel ptsd
55242;analysi caus damag waterwal tube middl radiant section result test pk boiler
604007;preval hepat c viru infect genotyp subtyp migrant pakistan barcelona spain
990554;novel composit metric predict patient satisfact spinal cord stimul
721048;information seek strategi peopl multipl sclerosi spain infoseek m studi
609176;select inhibit β hydroxysteroid dehydrogenas type attenu high fat diet induc hepat steatosi mice
148663;circ upregul mapk express promot prolifer metastasi metabol abil thyroid cancer spong mir
245453;connect feedback self efficaci receiv provid peer feedback teacher educ
66753;long rang interdomain commun eif b regul gtp hydrolysi translat initi
361035;relationship triglycerid glucos index risk stroke elderli hypertens patient
107163;nake mole rat undergo development oncogene induc dna damage induc cellular senesc
30720;human adapt invas speci conceptu framework base case studi metasynthesi
160676;substanc abuse rel self stigma women substanc use disord comorbid posttraumat stress disord
715205;relationship inhal long act bronchodil cardiovascular outcom patient stabl copd meta analysi systemat review random trial
627631;atp a medi endo lysosom polyamin export counter mitochondri oxid stress
52039;role accultur social capit access health care meta studi hispan
335710;navig cognit bias search sustain
307746;sugar sweeten beverag intak adulthood adolesc risk early onset colorect cancer women
222543;effect hallux valgu surgeri qualiti life
856552;transnat welfar manag accommod transnat live norway
154577;brain to brain commun music improvis perform case studi
249872;promot mechan serum amyloid famili express mous intestin epitheli cell
42970;predictor visual impair follow paraclinoid aneurysm surgeri special consider surgic microanatomi relat paraclinoid structur
497235;homeologue specif express diverg recent form tetraploid capsella bursa pastori brassicacea
541996;long non cod rna linc serv spong mir p promot prostat cancer progress regul rab
107522;prison environ non communic chronic diseas modifi risk factor length incarcer trend analysi mexico citi
821207;relationship obesity rel anthropometr indic cognit function chines suburb dwel older adult
719606;asthma asthma control risk acut myocardi infarct hunt studi
435493;structur transit scaffolding driven assembl viral capsid
219263;nanoparticl deliveri immunostimulatori oligonucleotid enhanc respons checkpoint inhibitor therapeut
443738;happen next current knowledg clinic perspect pregnanc denial children s outcom
139369;dual self regul deliveri insulin glucagon hybrid patch
827769;disulfiram copper combin therapi target npl cancer stem cell extend surviv medulloblastoma model
505593;respiratori support clinic outcom critic ill patient covid intens care unit retrospect studi
735024;early lif injuri produc lifelong neural hyperexcit cognit deficit alter defens behaviour squid euprymna scolop
204738;curcumin protect radiotherapy induc oxid injuri skin
738719;root growth plastic drought seedl perenni grass
729533;consort statement extens randomis crossov trial
648188;review time scale fundament g formula insidi select bia
105780;genome wid express profil rna sequenc spinal cord dorsal horn rat chronic postsurg pain model explor potenti mechan involv chronic pain
775429;influenza hemagglutination inhibit antibodi titer mediat vaccine induc protect influenza b
385239;implement post occup evalu social hous complement bim case studi chile
681616;regul erk basal pulsatil activ control prolifer exit stem cell compart mammalian epidermi
667679;integr underli structur stochast commun ecolog
770085;parent well b time covid germani
171517;identifi combin effect share autonom vehicl congest price region job access
303206;snapshot current statu alzheim s diseas treatment perspect in vitro in vivo research studi futur opportun
208881;recoveri debt reveal ecosystem network bas approach
850255;genom analys provid insight evolut salin adapt halophyt tamarix chinensi
494069;physician experi sick absenc certif finland
68324;satr dl improv surgic skill assess task recognit robot assist surgeri deep neural network
243082;creat energi citizenship materi particip
742374;character wood properti cedrelinga cateniformi substitut timber use window manufactur outdoor applic
964612;proteom identif marker signatur mapki resist melanoma
489759;therapeut mk inhibit block patholog vascular smooth muscl cell phenotyp switch
146683;cd dynam calibr basal nf κb signal t cell thymic develop peripher activ
955359;canon noncanon ethylen signal pathway regul arabidopsi suscept cyst nematod heterodera schachtii
39770;thyroid replac therapi thyroid stimul hormon concentr long term health outcom patient hypothyroid longitudin studi
670118;seropreval effect hbv hcv co infect immuno virolog respons adult hiv infect person anti retrovir therapi
738712;chang non protein thiol root organ acid xylem sap involv cadmium transloc cadmium saf rice line oryza sativ l
34769;test telediagnost right upper quadrant abdomin ultrasound peru new horizon expand access imag rural underserv area
404257;measur properti promi short form pain function orthoped foot ankl surgeri patient
343640;ethic use social media data clinic context
79629;glucos trigger strong taxon specif respons microbi growth activ insight dna rna qsip
719275;surface modifi nanocellulos applic biomed engin nanomedicin review
638565;primari hepat neuroendocrin tumor mimick ruptur hepatocellular carcinoma afp elev case report literatur review
120594;photodissoci transit state character chirp puls millimet wave spectroscopi
219844;optofluid real tim cell sorter longitudin ctc studi mous model cancer
303603;human intestin bitter tast receptor regul innat immun respons metabol regul obes
467421;underrepresent hispan minor clinic trial recruit perspect
667365;recurrence fre surviv outcom base novel classif combin lymphovascular invas perineur invas t statu stage ii iii colon cancer
993184;mate choic pollut world consequ individu popul commun
831083;identif key gene function pathway radioresist non smal cell lung cancer
838456;effect covid lockdown human sleep rest act rhythm
62909;optim use perampanel asian patient epilepsi expert opinion
816949;comparison efficaci safeti transarteri chemoembol lenvatinib unresect hepatocellular carcinoma retrospect propens score match analysi
693688;patient dissoci corneal topographi epitheli map
694009;pdlim repress ro alveolar macrophag promot lung tumorigenesi
145152;releas activ peptidylarginin deiminas circul acut inflamm induc coronari arteri bypass surgeri
276634;major defect diagnost solid insul power transform
99745;promot adropin express hyperglycemia associ stat activ diabet rat
417515;classif geostatist index spatial depend
880877;insolubl polysaccharid sclerotium poria coco improv hyperglycemia hyperlipidemia hepat steatosi ob ob mice modul gut microbiota
466111;egfr medi tyrosin phosphoryl sting determin traffick rout cellular innat immun function
594393;nicorandil prior primari percutan coronari intervent improv clinic outcom patient acut myocardi infarct meta analysi random control trial
496079;percept versu prefer role self assess risk measur individu mitig behavior covid pandem
846183;f librari fluorin fsp rich fragment expediti f nmr base screen
799525;rapid repeat host plant shift drive reproduct isol follow recent human medi introduct appl maggot fli rhagoleti pomonella
289722;poa annua annual speci
542107;delirium assess tool use critic ill adult psychometr analysi systemat review
800430;identif transcript factor differenti express neuroinflammatori condit analysi rna seq dataset combin unconvent exploratori approach
167526;stakehold engag keep busi legitim austria s natur miner water bottl industri
737118;csr feminist organ studi integr theoriz analysi gender issu
575954;identif degrad signal carboxi terminu srebp new role domain cholesterol homeostasi
649379;cardiovascular risk health check perform opportunist follow invit letter cohort studi
862536;inositol polyphosph promot t cell independ humor immun regul bruton s tyrosin kinas
859220;camsap break homeostat microtubul network instruct neuron polar
606801;benefit individu feedback internet bas intervent depress random control trial
490869;doe health requir novel ethic framework
294729;commun scienc valid climat suitabl project ecolog nich model
966816;stereotact radiosurgeri manag limit brain metastes systemat review intern stereotact radiosurgeri societi practic guidelin systemat review intern stereotact radiosurgeri societi practic guidelin
892925;human nasal wash rna seq reveal distinct cell specif innat immun respons influenza versu sars cov
601409;earli tropic crop product margin subtrop temper polynesia
164223;mir p suppress non smal cell lung cancer tumourigenesi inhibit plk
676107;model select north american breed bird survey
426416;chelicerata sdscam isoform combin homophil specif defin uniqu cell recognit
971093;regular integr equat method elast scatter problem dimens
979285;studi variat differ express serum protein hainan black goat breed cycl use isobar tag rel absolut quantit itraq technolog
797619;legaci histor exploit natur resourc import summer warm recent biomass increas boreal arct transit region
756242;institut collect garden compar analysi urban commun garden anglophon german speak countri
13526;exposur heavi metal coal gangu soil outsid mine area use bcr convent vortex assist singl step extract method impact orchard grass
583611;antileishmani activ cytotox zno bas nano formul
710602;adapt text messag intervent promot well b health behavior adher patient cardiovascular diseas intervent design preliminari result
777035;provinci differenti effect intern migrat teenag fertil south africa
294068;classifi task perform electr line worker use wrist worn sensor data analyt approach
140149;finit element analysi two competing speci keller segel chemotaxi model
124587;transport engin nanoparticl soil aquif
225387;interst migrat employer to employ transit unit state new evid administr record data
950063;correct osteotomi physeal bar resect distal radial physeal arrest flexibl nail case report
625869;detect ferritin express soft tissu sarcoma mri potenti implic iron metabol therapi
103909;gibb paradox deriv composit entropi
546717;pcsk overexpress rectal cancer correl poor respons preoper chemoradiotherapi prognosi
165982;rifampicin conjug silver nanoparticl new arena develop antibiofilm potenti methicillin resist staphylococcu aureu klebsiella pneumonia
260977;influenc patient report treatment satisfact psycholog health qualiti life patient receiv divya swasari coronil kit covid find cross sect satisfact covid survey
215531;ampk mediat regul glomerular volum podocyt surviv
220960;discoveri terbinafin low suscept trichophyton rubrum strain japan
891476;understand evolv pandem analysi clinic time delay distribut covid unit kingdom
585345;angptl influenc therapeut respons patient neovascular age rel macular degener promot choroid neovascular
316207;factor influenc univers student intent use moodl studi macau
66726;benefit harm screen men abdomin aortic aneurysm sweden registry bas cohort studi
882796;improv recoveri ancient dna subfossil wood applic world s oldest late glacial pine forest
671396;appli innov model disast resili neighborhood level copewel new york citi experi copewel new york citi experi
877036;effect solidifc rate microstructur primari carbid aisi dc cold work tool steel
469853;new record updat checklist mosquito speci quintana roo mexico use dna barcod
190555;current perspect tube feed elderli identifi malnutrit provid enter nutrit
946137;prognost valu tp mutat locat metastat breast cancer detect next gener sequenc
48484;assembl membran domain atp synthas human mitochondria
528;suppress singl bahd gene setaria viridi caus larg stabl decreas cell wall feruloyl increas biomass digest
423820;associ atherosclerosi diabet retinopathi chines patient type diabet mellitu
