221437;hematolog abnorm associ factor undernourish under f children attend univers gondar special referr hospit northwest ethiopia
733513;act volunt refuge local respons global challeng
365112;calcul densiti refract index vapor pressur nonelectrolyt binari solut
65348;length stay follow percutan left atrial appendag occlus data prospect multicent amplatz amulet occlud observ studi
681776;senkyunolid protect neural cell corticosterone induc apoptosi modul protein phosphatas a α synuclein signal
450913;multipl rout interspecif territori sister speci north american perch bird
649121;factor associ discontinu activ surveil men low risk prostat cancer population bas studi
721198;redox ph gradient drive amino acid synthesi iron oxyhydroxid miner system
26462;exosom β cell promot differenti induc pluripot stem cell insulin produc cell microrna depend mechan
73781;interrupt tgf β ccn integrin α β signal allevi high mechanical stress caus chondrocyt fibrosi
877977;distribut gap cataract surgeri care impact senior ontario
787482;estim skelet kinemat freeli move rodent
612263;radiolog correl vocal fold bow marker parkinson s diseas progress cross sect studi util dynam laryng ct
219639;understand clinician perceiv barrier facilit optim use acut oxygen therapi adult
810304;trajectori opioid coverag long term opioid therapi initi nation cohort veteran
53372;despit high object numeraci lower numer confid relat wors financi medic outcom
551230;population level mortal associ hiv exposur hiv uninfect infant botswana south africa model bas evalu
158993;multipl conjectur min max theori
411995;use regulatori stanc commerci determin health
118265;suscept brain atrophi trib alzheim s diseas evid function priorit imag genet
164823;iron regul transport play essenti role uptak transloc grain load manganes iron barley
948166;short time shift risk injuri danish hospit worker register bas cohort studi
572708;finit element method help explain fatigu crack growth retard acceler
482193;central role magnesium homeostasi adapt osmot stress
230567;clinic signific continu treatment nintedanib month idiopath pulmonari fibrosi real world set
199568;prepar optim concanavalin a conjug dynabeads magnet bead cut tag
63178;better characteris deep div whale distribut use prey distribut model output
949908;shape constraint econom oper research
517688;crocin act neuroprotect mediat methylphenidate induc neurobehavior neurochem sequela possibl role creb bdnf signal pathway
151478;treatment relaps acut leukemia ara c plu donor lymphocyt infus use cd cell reserv time allogen transplant
776510;copd anticoagul therapi time new approach
845247;interspecif prey neighborhood shape risk predat savanna ecosystem
266280;uterocerv angl cervic length tool predict preterm birth threaten preterm labor
683338;bicellular pollen modul dna replic pollen develop arabidopsi
135231;distribut experi demonstr widespread sodium limit grassland food web
463279;independ necess life satisfact necess opportun entrepreneur countri
856789;confid plant slow growth moder mediat model predict voic behavior power distanc orient team bas self esteem taiwanes nurs
94216;postpartum depress preval risk factor indigen non indigen immigr women canada
178375;mir antagomir reduc arrhythm risk myocardi infarct upregul cardiac sodium channel
265684;thermophys perform sm xlux tao x ceram
962271;direct select bodi size appar surviv cost larg wild new zealand giraff weevil
910554;impact insur coverag util prescript contracept evid afford care act
153706;evalu atsdr s mrl epa s rfcs rfd similar differ rational
428323;effect nicorandil neurobehavior function bbb integr edema stereolog paramet brain sub acut phase stroke rat model
220533;genom blueprint relaps fever pathogen th centuri scandinavia
663336;melatonin promot sleep activ bk channel c elegan
379341;nutrigenom studi hilsa evalu flesh qualiti attribut gene associ fatti acid metabol river hooghli padma
795505;waterfowl use tail pond comparison beaver pond boreal eastern canada
105835;fsip regul autophagi breast cancer
306534;prepar electrochem perform ultra thin reduc graphen oxide lithium metal composit foil
627010;influenc marit statu small intestin adenocarcinoma surviv analysi surveil epidemiolog end result seer databas
653139;consequ invas pollen transfer pollin reveal tropic island ecosystem
495077;game boy qualit studi experi commerci shelf game
412007;fundament character scratch resist automot clearcoat
126708;comparison major complic surviv rate surgic ligat use canin ductal occlud devic treatment dog left to right shunt patent ductu arteriosu
70489;real tim evolut support uniqu trajectori gener pollin
214314;digit treatment pain versu standard care cluster random control trial rise up
328719;anxieti depress medic doctor catalonia itali uk covid pandem
97596;support spartina interdisciplinari perspect show spartina distinct solid genu
862351;migrat soil microb promot tree seedl toler dri condit
694942;measur activ engag old age exploratori factor analysi
591293;acylcarnitin biomark diabet nephropathi
681236;stress induc antioxid defens protein chaperon respons freeze toler wood frog rana sylvatica
372274;emerg new sovereign wealth fund fashion phenomenon
659540;abelacimab prevent venou thromboembol
585532;unearth belowground bud bank fire pron ecosystem
320843;canadian upland forest soil profil carbon stock databas
734495;coffe consumpt all caus cause specif mortal meta analysi potenti modifi
506519;dynam hspa a redox statu spermatozoa fluid differ segment goat epididymi
446924;evalu asymmetr dimethylarginin serum level left ventricular function d speckl track echocardiographi children regular hemodialysi
701204;knockdown cahsp confer enhanc sensit heat stress pepper capsicum annuum l
911849;tensil test age flexibl unidirect composit lamin bodi armor
22219;evid map qualiti assess systemat review therapeut intervent oral cancer
196877;biomed potenti plant bas selenium nanoparticl comprehens review therapeut mechanist aspect
561520;clinic trial abcb mesenchym stem cell recess dystroph epidermolysi bullosa
288935;function character aluminum al induc transcript factor art reveal differ pathway al toler rice
261417;cerebr blood flow stroke patient sleep apnea role single night posit airway pressur therapi
491526;compar efficaci safeti non steroid anti inflammatori drug patient juvenil idiopath arthriti systemat review network meta analysi
439249;genom evolut arbuscular mycorrhiz fungu diversispora epigaea formerli glomu versiform bacteri endosymbiont
567357;identif immune rel gene patient acut myocardi infarct use machin learn method
612273;elastomer half mask respir altern dispos respir solut shortag public health emerg
284521;comparison result body mount inerti sensor assess final lame determin equid
344596;interwoven tradit bell beaker metallurgi approach social valu copper bauma del serrat del pont northeast iberia
960417;femal platelet distinct function activ compar male platelet implic transfus practic treatment trauma induc coagulopathi
585955;propagul equal trait veget fragment disturb regul invas success
265696;simultan bilater chronic volar lunat disloc case report
260583;malat promot cell tumorigen regul mir p eef axi non smal cell lung cancer
227117;state impos common pastor reintroduct brown bear pyrene
910926;whole genom dna methyl pattern complex associ gene express associ anthocyanin biosynthesi appl fruit skin
695943;econom reason want second child chang onset econom recess itali
109700;parp inhibitor metastat prostat cancer evid date
192375;three year outcom dorsal root ganglion stimul treatment neuropath pain peripher nerv injuri upper lower extrem
647984;influenc dietari habit depress patient rheumatoid arthriti cross sect studi use kurama cohort databas
33618;unregul antigen pres cell activ t cell break self toler
216863;structur function aspect interact partner small heat shock protein synechocysti
136571;alter glycerophospholipid fatti acyl metabol multipl brain region schizophrenia microbiota recipi mice
232445;mgreenlantern bright monomer fluoresc protein rapid express cell fill properti neuron imag
256299;enter fistula hip fusion mass year arthrodesi case report
533597;marin penetr injuri shoulder uncertain origin
306419;high express mir b predict poor prognosi patient ovarian cancer
893067;dung beetle medi soil modif data set analyz effect recent introduct soil qualiti
367375;arabidopsi translat initi factor eifiso g link repress mrna cap bind complex eifiso f assembl rna bind protein soar medi aba signal
83267;relationship cell surfac hydrophob biofilm format growth rate studi pseudomona aeruginosa staphylococcu aureu escherichia coli
273395;linc myh configur ino regul muscl stem cell number skelet muscl hypertrophi
429612;chronic pelvic diastasi year twin natur deliveri case report
161220;cost effici analysi improv web bas plan budget report planrep tanzania
565620;eif loop interact met trnai control accuraci start codon select scan preiniti complex
236795;abil nutrit mitig epigenet drift novel look regul gene express
169602;sustain face institut advers market turbul network embedded innov orient
199674;popul age migrat product europ
938364;novel synthet deriv biaryl guanidin potenti bace inhibitor treat alzheim s diseas in silico in vitro in vivo evalu
347738;bacteria push limit chemotact precis navig dynam chemic gradient
897700;ptenp pseudogen unlik pten gene methyl normal endometrium endometri hyperplasia carcinoma middle ag elderli femal
147562;effect temperatur germin western australian herbac speci
109278;electr control spatial resolut mixed dimension heterostructur photodetector
218002;mutat ephb caus human venou valv aplasia
403954;cancer metastas lung adenocarcinoma disappear molecular target therapi success clinic treatment experi
756425;ipo firm perform link board offic gender family ti demograph
601545;neighbourhood dispar price cheapest cigarett usa
997357;plu greater two mix litter type acceler decomposit low qual alpin dwarf shrub litter
219360;molecular structur electron distribut nitropyridin n oxid experiment theoret studi substitu effect
986203;secondari osseou integr cementless unicompartment knee arthroplasti intern fixat felix type iiib fractur case report
62887;minim invas transforamin lumbar interbodi fusion use banana shap straight cage radiolog clinic result prospect random clinic trial
305138;link econom growth pathway environment sustain understand develop altern social ecolog regim
122173;integr comput vision technolog smart surveil purpos
648134;better predict long term benefit risk weed biocontrol evolutionari perspect
614142;factor associ turnov intent healthcar worker coronaviru diseas covid pandem china
184655;talk benefit breastfeed signific default represent infant feed
491262;surgic white matter chassi practic dimension atla plan subcort surgic trajectori
979406;manag foreign organ materi identifi primari total knee arthroplasti case report
972447;genom determin pathogen sars cov human coronavirus
46866;lumbar spine surgeri lost era coronaviru pandem survey lumbar spine research societi survey lumbar spine research societi
724679;target knockout chemokine lik gene increas anxieti fear respons
743573;new perspect predict postop complic high risk ulcer coliti patient machin learn preliminari approach
367167;markovian approach model intracellular reaction process molecular memori
270408;effect deep cryogen cycl treatment structur properti metal glass review
78711;plasma exchang glucocorticoid sever anca associ vascul
408701;tyrosin phosphoryl ampa receptor subunit glua gate homeostat synapt plastic
86715;exagger meta percept predict intergroup hostil american polit partisan
715624;electroacupunctur therapi inflamm regul current perspect
466413;project pursuit high dimens
825916;semaglutid allevi hepat steatosi t dm combin nfald mice mir abhd
439632;bcl modul tissu neutrophil surviv exacerb pulmonari inflamm follow influenza viru infect
140871;serum exosom mirna novel liquid biopsi identifi leptomening metastasi non smal cell lung cancer
720763;effect digit platform bas implement strategi prevent work stress healthcar organ month follow up control trial
329396;dna nanoswitch barcod multiplex biomark profil
783821;fluctuat norm rehabilit practition perspect ambigu uncertainti work person disord state conscious traumat brain injuri
184862;interdisciplinari work public health research propos good practic checklist
834096;improv eeg bas motor imageri classif spatial tempor recurr neural network
215745;diagnosi guillain barré syndrom total hip arthroplasti case report
741465;serotonin transporter medi molecular axi regul region retin ganglion cell vulner axon regener nerv injuri
269355;start parent isol qualit user initi studi parent experi hospit neonat intens care unit covid pandem
371102;synergi multipl zeitgeb tune entrain
791512;root induc soil acidif cadmium mobil rhizospher sedum plumbizincicola evid high resolut imag studi
920055;right w popul self rat health europ multilevel analysi
555082;organ farm local landscap scale foster biolog pest control vineyard
667383;assess math anxieti elementari schoolchildren spanish version scale earli mathemat anxieti sema
60567;rip kinas mediat angiogenesi modul macrophag experiment neovascular
11032;know enough have enough feel want challeng commun health worker provid matern newborn servic africa asia
84170;blue light signal transduct pathway involv anthocyanin accumul red zaosu pear
704624;preval diabet mellitu novel coronaviru meta analysi
762583;rickettsia conorii o antigen target bactericid weil felix antibodi
47220;abdomin aortic aneurysm natur histori pathophysiolog translat perspect
722063;microribonucl acid a p alter adriamycin resist breast cancer cell target cell divis cycle associ protein
67576;cancer mut network number specif driver mutat
737292;linear hypothesi test high dimension gener linear model
635010;host parasit coevolut promot evolut seed bank bet hedg strategi seed bank host parasit coevolut
863504;scale depend effect host patch trait speci composit stickleback parasit metacommun
442;high preval low allele fract somat mutat stat peripher blood cd cell multipl sclerosi patient control
91018;hysterectomi perceiv physic function middle ag australian women year population bas prospect cohort studi
31492;metric sexual select conform bateman s principl wind pollin plant
459919;scope review active learn strategi teach social determin health pharmaci
186744;markov model elucid alloster regul
638340;correl evolut self interspecif incompat rang texa wildflow
383453;challeng battl plant phloem feed insect prokaryot pathogen
878341;diosmetin inhibit cell prolifer induc cell apoptosi cell cycl arrest liver cancer
413280;penicillin trunk inject affect bacteri commun structur citru tree
388212;coloni ascidian strongli prey upon domin substrat subtrop foul commun
109188;low penetr suscept variant postmenopaus oestrogen receptor posit breast cancer
389150;antioxid activ recombin rat hepat fatti acid bind protein t a variant
546337;short term effect corona viru diseas vaccin menstrual cycl
843162;character knowledg educ receiv train systemat literaci instruct
483083;preval extended spectrum β lactamas carbapenemas produc gram neg bacteria methicillin resist staphylococcu aureu isol diabet foot ulcer patient ethiopia
657256;terrestri passiv acoust monitor review perspect
772536;acalabrutinib therapeut potenti treatment chronic lymphocyt leukemia short review emerg data
778013;group sing improv depress life qualiti patient stabl copd random community bas trial china
500354;determin qualiti life women immedi follow complet primari treatment breast cancer cross sect studi
841935;safe reopen colleg campus covid univers california experi fall
256385;heart rate variabl occup stress systemat review
703331;quantifi causal pathway contribut natur select
173597;redefin bilingu spectrum experi differenti affect brain structur function
510791;optim sequenc avail therapi line advanc prostat cancer
64318;hyperbar oxygen therapi covid patient respiratori distress treat case versu propensity match control
439329;plasmodesm regul plant pathogen interact
194404;patient use self monitor app eat disord treatment naturalist longitudin cohort studi
456635;relationship body round index metabol syndrom type diabet
435768;fertil famili size prefer contracept use sub saharan africa
871117;differenti diagnos food rel gastrointestin symptom patient anorexia nervosa bulimia nervosa review literatur
805467;bcg vaccin protect sever coronaviru diseas covid
315728;effect warn messag driver s stop go decis red light run behavior fog condit
905419;target co sleep children anxieti disord use modifi bedtim pass intervent case seri use chang criterion design
260113;β glucan saccharomyc cerevisia allevi oxid stress lps stimul raw cell dectin nrf ho signal pathway
622382;role microvesicl tumor progress clinic applic
292208;short term exposur fine particul matter hospit admiss risk cost medicar popul time stratifi case crossov studi
796256;bidirect titrat yeast gene express use pool crispr guid rna approach
666066;clinic characterist outcom covid hospit patient chronic condit retrospect single cent studi
918387;integr bim vr implement ipd mode transport infrastructur project design case applic
362485;burrow crab weaken mutual foundat speci
187890;trade off toler resist infect experiment approach malaria parasit passerin bird
855038;ecophysiolog properti biolog soil crust type photoautotroph succul karoo south africa
702380;matern mortal georgia incid caus level underreport nation reproduct age mortal studi
497034;day mitral valv reconstruct chang year
753732;weed suppress cover crop monocultur mixtur
675394;rel contribut dnra denitrif nitrat reduct thalassia testudinum seagrass bed coastal florida usa
210405;liver master servant serum proteom
238598;cytochrom p cyp a key product hederagenin bas saponin mediat plant defens herbivor
484327;recent insight nanomedicin augment infect control
847207;soft conduct micropillar electrod array biolog relev electrophysiolog record
419087;plant speci domin increas pollin complementar plant reproduct function
843267;anchor techniqu use long bent rod open reduct thoracolumbar disloc
573103;interfaci fluid transport key hydrogel bioadhes
291866;trna pseudouridin synthas trub regul matur let mirna
706428;enhanc growth salt toler tomato seedl natur halotoler actinobacterium glutamicibact halophytocola klbmp isol coastal halophyt
789995;syndrom inappropri antidiuret hormon secret siadh optim manag
966334;unilater cleft lip nasal deform three dimension analysi primari deform longitudin chang follow primari correct nasal foundat three dimension analysi primari deform longitudin chang follow primari correct nasal foundat
851324;artifact d new softwar accur object effici d analysi document archaeolog artifact
56607;circul tumor dna current challeng clinic util
4751;cardiovascular risk factor event iranian immigr versu immigr middl east
386033;metabolit bind protein moonlight bile respons chaperon
612677;artifici neural network model liver cirrhosi diagnosi patient hepat b virus rel hepatocellular carcinoma
583683;share extrem ectotherm endotherm bodi elong mustelid associ small size reduc limb
102048;rangeland share cattl bee moder graze doe impair bee commun resourc avail
841566;spatial analysi g f fuscip abund uganda use poisson zero infl poisson regress model
522176;insect pectin antenna maxim odor captur effici intermedi flight speed
15260;nodular fasciiti breast mimick phyllod tumor case report literatur review
775810;differenti characterist acinetobact baumannii colon infect risk factor clinic pictur mortal
361948;long covid health inequ role primari care
738979;post covid vaccination associ neurolog complic
12251;individualis comput model immun mediat diseas onset flare clearanc psoriasi
961423;boni labyrinth morphometri reveal hidden divers lungless salamand famili plethodontida structur correl ecolog develop vision inner ear
902480;self med practic associ factor univers gondar colleg medicin health scienc student cross sect studi
849919;macrocycl asparaginyl endopeptidas
597100;death year potenti life lost excess alcohol use unit state
796841;mads box gene underground mainstream plant root development mechan
938642;select serotonin reuptak inhibitor ssri serotonin norepinephrin reuptak inhibitor snri pregnanc risk autism spectrum disord asd attent deficit hyperact disord adhd offspr true effect bia systemat review meta analysi
596128;herbivor fish rise destruct fish practic fall indonesian marin nation park
977360;cross sect averag length life childless
319567;use bodi composit assess evalu doubl burden malnutrit
580184;methylcrotonoyl coa carboxylas promot prolifer migrat invas inhibit apoptosi prostat cancer cell regul glud p mapk signal pathway
143249;platelet rich plasma manag chronic low pain critic review
115476;treatment chondroblastoma denosumab case report correl analysi effect rank signal pathway
916513;mutual interplay il produc γδt cell microbiota orchestr oral mucos homeostasi
259218;use partial squar identifi dietari pattern associ obes nationally repres sampl canadian adult result canadian commun health survey nutrit
448992;dynam reflect multidimension health poverti pakistan
45668;maackiain protect kidney type diabet rat modul nrf ho tlr nf κb caspase pathway
126353;second ord effici algorithm coupl nonlinear model groundwat transport
777176;novel timosaponin aiii bas multifunct liposom deliveri synergist therapi hepatocellular carcinoma cancer
532885;fabp inhibitor attenu inflamm endoplasm reticulum stress islet leptin receptor knockout rat
459026;elucid g overshoot soft materi yield transit time resolv experiment strain decomposit
534907;cellular mechan treatment chemobrain insight age neurodegen diseas
630505;untold stori human cervic cancer hpv neg cervic cancer
786844;critic period regul multipl timescal
603127;publicli fund health care pregnant undocu immigr achiev moral progress overlap consensu
574876;risk factor nonalcohol fatti liver diseas postmenopaus women type diabet mellitu correl bone miner densiti differ locat
13534;excited st proton transfer reliev antiaromat molecul
905589;enclos pen postal questionnair follow up increas respons rate studi trial
219337;german univers multipl hybrid organ
274662;evid human medi rang expans gene flow invas grass
454801;human eutroph drive biogeograph salt marsh product pattern china
340459;medic school wrong applic pool
642166;ast improv cardiac dysfunct acut kidney injuri mice suppress apoptosi proinflammatori nf κb icam signal
466098;longitudin genotype phenotyp analysi patient pax rel aniridia
579068;respiratori symptom cardiovascular caus death population bas studi year follow up
225081;factor influenc public knowledg willing particip biomed research jordan nation survey
558146;involv ddah activ spinal no signal earli stage mechan allodynia induc exposur ischem stress mice
990729;arabidopsi ubiquitin specif proteas ubp ubp shape ore level leaf senesc induc nitrogen defici
21574;oppos indirect effect domest herbivor saltmarsh eros
863660;fecal microbiom profil neonat dairi calv vari sever gastrointestin diseas
230430;matern metabol health drive mesenchym stem cell metabol infant fat mass birth
461109;corticosteroid critic covid corticosteroid equal
915510;associ air pollut year clinic outcom patient acut myocardi infarct
847364;nk cell associ al sex age depend manner
961490;enabl earli detect osteoarthr presymptomat cartilag textur map transport bas learn
334277;novel chitosan oligosaccharide bas nanoparticl gastric mucos administr phytochem apocynin
998261;biomechan evalu preliminari clinic result anterolater screw fixat obliqu lumbar interbodi fusion surgeri
856778;ultrasound assist prepar exopolysaccharide nystatin nanoemuls treatment vulvovagin candidiasi
468818;matern brain women histori early lif maltreat imagination bas fmri studi conflictu versu pleasant interact children
580354;demographi select shape transcriptom diverg field cricket evolutionari forc shape genet variat
74356;determin covid vaccin hesit spectrum
409269;revis later ankl reconstruct year chrisman snook procedur case report
306306;iceberg sea ice blue carbon antarct climat feedback
530793;xanthelasma palpebrarum brief review
159954;development chang myocardi b cell mirror chang b cell associ differ organ
65084;unpack role telecommut s job perform examin job complex problem solv interdepend social support
250700;effect yupingfeng granul acut exacerb copd random placebo control studi
788422;new perspect predict statist quantif extrem event high dimension dynam system
39317;cortic activ attack ménièr s disease a case report
705736;temperatur account biodivers hyperdivers group insect urban lo angel
864388;effect open trial internet deliv parent train young children conduct problem live region rural australia
196532;kdm b protect obes metabol dysfunct
739042;predict function respons agro ecosystem anim movement data improv manag invas pest
7098;origin transpar scatter biomimet collagen materi
731876;quantit studi geometr characterist format mechan poros defect select laser melt ti al v alloy micro comput tomographi
545354;deoxy δ prostaglandin j potenti regul bone metabol pparγ depend independ pathway review
71029;parvalbumin interneuron ventral hippocampu function discrimin social memori
175664;use intervent map behavior intervent technolog framework develop mhealth intervent physic activ sedentari behavior chang
44510;predict graduat rate year broad access institut use bayesian model approach
272029;target therapi advanc metastat cholangiocarcinoma focu clinic potenti infigratinib
438008;guava leaf extract attenu insulin resist pi k akt signal pathway type diabet mous model
394275;comparison periop outcom single port multiport robot assist laparoscop prostatectomi
